Username,Review,Rating,Total_reviews,Followers,Expert_level
Shivaksha Bhardwaj,"Rated Went there with much expectations with my friends, ordered paneer tikka, they served only four pieces, ordered a paneer dish in which they gave only four pieces. So i would definitely not go there again, extremely dissatisfied with the quantity they served. Only taste was somewhat up to the standards but nothing as such great which one expects from such hyped north indian cuisine restaurant. Pathetic service.",Rated 2.5,2,0,??
Natash Kapur,"Rated This is my 1st review for the restauremt , it is good to good review , so that ppl know your experience . we had nice experiance here. Their chole bhature are the best I ever tasted.",Rated 4.5,35,576,??
Rishav Raj,"Rated Few months back I went to this place for dinner, and believe me it made my day after I had Chicken Biryani and Lassi! Very well decorated and neat interiors, dedicated service, comfortable seating, and good food. Whenever I am around CP and I feel like eating biryani I just check in Punjabi by Nature!",Rated 4.0,32,14,??
Mayank Mehta,Rated The express thali concept here is brilliant! The food and service both were really good even at 11 in the night! The pocket pinch is also quite affordable.,Rated 4.0,25,149,??
Moumita Majumdar,"Rated Whenever I eat out I don't really opt for Indian, as that is what we always have at home anyway. But my mom came to town from Kolkata and I wanted her to try some authentic North Indian food, thus we went to this restaurant. The service is quite quick and efficient. The waiters are pleasant and the menu is really good. We ordered the thalis which had one meat preparation, dal makhani, one kebab, rice, nan, raita, gulab jamun and salad. I ordered the thali with the galoti kebab and meat Pbn. It was great. The kebabs were soft and juicy and the meat was succulent. Mom ordered the butter chicken and tandoori chicken thali, even that was pretty amazing. The quantity is a lot, and for that, the prices are pretty reasonable. We also had the Punjabi mattha, and the Jaljeera drinks which were good. The fresh lime soda, however was a disappointment. Overall, an amazing experience.",Rated 4.0,67,505,??
Foodaholic,"Rated PBN quickie Interior is beautiful mirrors paintings just perfect Not a very big outlet nt gd thing is Tht seating area is nt too messy. Staff is gd n service is quick We ordered veg kebab platter, veg biryani, mango lassi n fresh lime soda Non veg / Veg kebab platter here is famous I mean all the tables around me hAd ordered tht So the veg platter includes 2 pc each of paneer tikka, bharwan aloo n dahi k kebab nd all of ths ws served vth dal makhani n naan In the name of salad only carrot was served Dahi ke kebab were too Gd thy just melt in the mouth Rest of the stuff ws ok ok Biryani was nt upto the mark The kind of fragrance a biryani should have ws missing n i ws surprised tht no raita and no onions were served vth it So had to order raita separately Also the rice used fr biryani ws nt tht gd It lacked taste as well Didn't enjoy biryani at all Mango lassi ws gd Nd lime soda was okayish Myt visit thts place again only fr dahi k kebabs",Rated 3.0,0,0,Expert in Connaught Place
Akhilesh Tripathi,Rated The food was nice and fulfilling. The bedmipuri with sabzi was perfect for a morning breakfast I went for here. The prices though are a little high and I felt that it could have been a little less too. The overall place is apt to visit once to get the desi taste.,Rated 3.0,85,190,??
Mansi Gupta,Rated No doubt that ambience is good..but food ..its a bit of compromise..we ordered gol gappe..it was good and well served..ordered veg platter ..roti was not that good..paneer was not that soft..dal makhni was good..even the sweetdish the gulabjamun lacked softness..,Rated 2.5,9,25,??
Saloni Raheja - TheCravingSoul,"Rated Just like its name, I'm gonna go quick here. We ate : JUMBO CHANNE BHATURE : There arrives a BIG BIG BIG BIG sized bhatura Taste - Good. Oily - Fairly Yes ! I've not eaten or seen this sized bhatura ever. Recommended. PAV BHAJI : Pav soaked in utter butter, 2 in quantity were the best so far I had in the city restaurants. Bhaji - properly mashed, balanced on herbs, butter and color ! GOLGAPPE TRAY : 8 Suji Golgappe, served with 4 flavours of water, imli being my favourite . Aam Panna, Imli, Pudina and Meetha Paani. Gol Puris could have been bigger in size. Also, made from wheat flour would have added double taste to the buds. Flavoured water urf Paani were served in shot glasses. Good on quantity and amazing on taste. Looking forward to taste its dahi k kebab and express thali. Service was Quick. Best Wishes, Cheers",Rated 4.0,0,0,Expert in Connaught Place
Vicki,"Rated Been there last night with family , very nice place for Family get together , not many items to choose from menu but watevwe there is very good. Ordered dal makhni which was real good but there tandoori mix veg with okra item was a bit undercooked for my taste rest is very good . Loved the service too",Rated 4.0,3,0,??
Anushka,"Rated Punjabi by nature quickie- The north Indian here is terrific! Must try: Dal Makhni & Shahi Paneer. Ordered a veg thali extremely filling for 2 people, yummy food and good prices! All of it in one place! A must try for all the north Indian food lovers!! The ambience is nice and staffs are courteous. Though its a small one still the food is worth it!",Rated 4.5,23,56,??
Nishant Aggarwal,"Rated Overall services was gud.. Staff was decent.. Manager will ask u ""how's the food ""? I ordered 1 Express Thali, 1 veg platter, Lahori paneer masala and Naans but only lacking things was quantity of Paneer, tey r giving..just 2 cubes in each course..",Rated 3.5,2,3,??
Tapesh Khanna,"Rated Another option to try the desi flavors loaded with extra butter, extra curries and extra love, for the most important part. They have introduced the raj kachori in their menu and it is way better than Haldirams one. The food was authentic and my family loved the dinner fully. The prices however, are high but totally worth the experience we had.",Rated 4.0,0,0,Expert in Connaught Place
Rumpa Sarkar,"Rated Delicious food, prompt service, perfect for a quick lunch! We had dahi k kabab, which was amazingly good, and the thalis for lunch were quite a few for us to choose from. The daal makhni, naan and gulab jamun are worth a mention, as they are the stars of the show :) Loved it and would recommend it to everyone!",Rated 4.5,9,57,??
Anu,"Rated Punjabi cuisines attract my taste buds always hence I got into this place while visited CP. my recommendation is to try Tandoori Veg Platter, Lahori Masala Paneer with Lehsuni Naan ... A place with very cozy ambience and good service to visit with your family",Rated 5.0,20,7,??
Anurag Nandi,"Rated A chique place to have some starters after some roaming around in CP. For non-vegetarians, Peshawari and Galouti kebabs are a must try. Enjoy the ambience, savour your food, talk to your friends, wash it all down with some wine...just experience the feeling of being there.",Rated 3.5,21,115,??
Arpita,"Rated Went there on a Sunday afternoon. Got a seat pretty quickly. The interiors of this place are really interesting. Coming to the food, coz that's the thing I went there for. They have a very selective menu..as the name of the place suggests 'Quickie'. Instead of going for the a la carte we ordered veg thalis. Precisely thali no 5,6 and 8. Amongst all the thalis we collectively gorged on, I found there veg seekh kebabs as most sumptuous. Galauti kebabs were also very good. I found the daal makhni (common in each thali) as very average. Wonder how so many people have liked it so much. Paneer makhni was very sweet but eatable. And lahori paneer masala was your typical kadhaai paneer,which personally I don't like much. Rice was plain and simple. Raita was good although a tad too sour. And to end the meal there was a hot gulab jamun in each thali. All in all the food was good and sufficient for one person considering you pay Rs299+ taxes for each thali. I would definitely consider this place again essentially for its ambiance and the finger licking veg seekh kebabs!",Rated 3.5,10,0,??
Parneeti Agnihotri,"Rated the name fits its name i.e quickie. You can have working lunch, nice service good food but ambience can have more options. can be visited. Located in popular N block",Rated 4.0,13,4,??
Vishwesh Vishal,Rated Starter was good but main course for dinner was totally bad. Not value for money. Service is also very poor. It's better to go for other restaurant in cp.,Rated 1.0,1,0,??
Amey,Rated A good place to have food. The interior is nice and the restaurant gives a homely feeling. We ordered paneer makhani and naan. The service was quick - our food was served in 10 mins. The waiters are not at all interested in their job - the only point about this restaurant that one might call as a negative. The taste and quality of food was without a doubt good. Do try this restaurant out. I don't you think one would be able to find such a wonderful blend of quality and cost at least in CP. Food - 8/10 Ambience - 8/10 Service - 6/10,Rated 4.0,72,176,??
Indrani Mukherjee,"Rated Like the high-ceiling interiors, paintings and over all ambience..food speaks for itself..one of the best biriyanis in town..though the place is renowned for its daal, the kebabs are to die for as well..express thali no 2 was good..loved the chocolate fudge which looks like a potted plant..because i went there late, the waiter rushed us through our beers with the midnight deadline..Cinderella was happy though with charming prince of food..",Rated 5.0,66,162,??
Lvlyffullest,"Rated I have mixed thoughts about this place. If you need cheaper and fine dining experience at the same time in CP, this is the place to go to. I went there along with 2 frnz, and the bill was just 850/-. Their chole bhature are the best I ever tasted. Light and soft. On the other hand, the tandoori alloo r perhaps the worst. Stuffed with raisins and cashews(both of which i happen hate, especially in their cooked form. This gave them a sweeter taste) and each piece was rolled in sesame seeds. The food on the whole is normally spiced without burning your pallette or stomach for that matter. Serving sizes are great. But what stole my heart there is the chole bhature, coz whenever I pass by this in CP, I just remember the taste of their bhaturas.",Rated 3.5,0,0,Expert in Connaught Place
Sandeep Chauhan,Rated Nice ambience having nice tasty food but services are really bad and they expect you to go immediately as soon as you done dinner. Overall worth going once especially for their platters.,Rated 3.0,9,11,??
Nikita Jain,"Rated This place truly lived it's name i.e. ""Punjabi by nature"". Mouth watering food was served to us, though it had a huge waiting line outside but it was worth it. Quite reasonable place with good ambience. Dal makhni and aam pana was the best amongst all. Must go place for north indian food lovers. You can't stop yourself from licking your fingers ;)",Rated 4.5,7,24,??
Anchit Jain,Rated We visited this place for a quick dinner. The ambience of the place is very nice. We ordered a Thali which had good options though the quantity wasn't as much as we had expected. Taste of the food was very nice. The service was a bit slow. All in all a nice place to visit with your family! Ambience - 4/5 Food - 4/5 Service - 3/5,Rated 4.0,0,0,Expert in Connaught Place
Rajesh Marwah,"Rated Decent place, good location, OK food but service need improvement. Went to have some light food there yesterday. Was OK but too expensive as per the portion. needs to be priced lower.",Rated 3.5,12,5,??
Sharad Mahajan,"Rated I always wanted to try this restaurant as it somehow used to attract me whenever I would cross from Janpath to the CP inner circle. I went here on a Sunday night.. I waited for about half an hour to get a table which I thought was due to it's great popularity.. The ambience was OKish type with average interiors.. we ordered veg thalis for 2. I had been to PBN in Noida and liked it big time due to it's food and quantity they serve. However, it was quite an opposite experience this time around with PBN quickie. In short the food was tasteless!! We ended up paying 900 for 2 veg thalis. To be honest the food wasn't worth even a single penny. I wasted myself in this restaurant on a Sunday night. I will probably not even go to the regular PBN restaurants after this incident.",Rated 2.0,4,23,??
Shreya Singhal,Rated Walked in this restaurant to taste the famous 'dal makhani' that my friend was babbling about for so long and I hell sure wasn't disappointed. Dal makhani was really delicious and naan complimented it very well. Also the ambience was simple and good!,Rated 3.5,9,44,??
KandwalSaab,"Rated A nice family restaurant with our northIndian Punjabi treats. The Glass n water they served had some unwated objects though they chnaged this but such mistakes are not acceptable and thus would rate a bit less. We personally loved the GolGappaas served with 4/5 waters- AamPanna,Jaljeera etc. I would advise to go for the Thali option rather than ordering for separate servings. Overall the taste is really good. Kebabs were a bit disappointing but other dishes were upto the mark.",Rated 3.5,0,0,Expert in Connaught Place
Charu Paliwal,"Rated More than me, my husband loves Punjabi food and hence he loves to visit all such places. It serves awesome Dal Makhni, Chole Bhature. Alcohol too is included. Do visit !!!",Rated 4.5,48,36,??
Prithvi Ganguli,"Rated nice location, OK ambience, quick service, food OK could be better. Little expensive, drinks very costly. can be visited once. ambience could be better",Rated 3.5,7,0,??
Athar,"Rated One of my Favorite places to walk in at CP. Pros : The food menu is delicious. Be it starters or the main course. Not once have I been disappointed by the serve. The express thali concept works wonder if you don't want to spend much and still have a stomachful of delicious stuff. Non veg : go for thali combo 1. And veg go for thali combo 5 ( I have tried almost all and these are my favorite ones.. Urs might differ) The service is fast and they maintain hygiene aptly. Try their golgappe plate.. Though I can never get enough of the quantity the shots (no no its not alcohol) are pretty amazing. Cons : they never make reservations. It's first come first serve basis. In weekends if you go between 8-10 pm, the waiting time could be as much as one hour. So that's a glitch if you are in for a hurry.",Rated 4.0,17,24,??
Satin Manchanda,"Rated Nt as expected. Order thalis the food was not so good in taste.. Rice in thali was not proper steamed kababs were ridiculous, roti we replace as not at all roast. I dont recomend to others..",Rated 2.0,15,4,??
Akhila,"Rated Amazing ambience to start with.. ordered aam panna,sweet lassi n mojito.. aam panna was such a relief! Sweet lassi n mojito wer equally good... n ordered fr masala peanuts fr starter. .. had an amazing tangy taste to it.. perfect fr starter.... den as fr main course v ordered fr express thali 5... had paneer tikka, dal makhni, naan , boondi raita , n rice... was a very good meal..but a lil heavy fr one person... overall had a very good dining experience . ..",Rated 4.0,7,1,??
Pavithra Pasupathi,"Rated First of all tis place is so well done up!! N its not a quickie.. Its a full time restaurant. Comin to food... We ordered sweet lassi, aam panna and a mojito. Mind blowing aam panna and sweet lassi... For starters there was masala peanuts... The quantity was perfect and tasted so authentic tat hands never went off them... For the Main Course we ordered express thali 5. The course was heavy for a person to eat... Very tasty dal makhani, paneer tikka, raitha, and huge naan... Loved the food... Wish I had place to have deserts as well... But was too full with the thali :-P Overall amazing experience Ambience 4.5/5 Taste 4/5 Cost 4/5 Service 4.5/5 Experience 4/5",Rated 4.0,55,175,??
Rangesh,Rated One of the worst taste of delhi.. Ordered Bedmi Puri wid aloo sag.. Puri was like a tasteless bhatura.. N saag was like gravy of potato.. Worst ever.. Never order pani puri.. It is even more worst..,Rated 1.5,2,2,??
Monisha Rajput,Rated My experience here didn't turn out to be as good as what i heard about. Maybe because i ordered for a thali. I really liked the decor of their premise. Staff was pleasing.,Rated 2.0,40,31,??
Mohit Garg,"Rated This is a hell of a place in CP for north indian food. I personally love it. Finger lickin good food. Be it their cholle bhature, dal makhani, paneer lababdar or non veg dishes like tandoori chicken or butter chicken, everything is so tasty. Apart from that, this place has a well trained staff, perfect location and a serene ambiance. Moreover prices are really adequate with respect to quantity and quality. My suggestion would be to go for their express thalis. They even serves sarso ka saag. Mayb they serve it seasonally, but that is also worth giving a try. A big thumbs up to you guys. Keep serving great food.",Rated 5.0,0,0,Expert in Connaught Place
Arun Satija,Rated Ate here a year back. I saw a lot of foreigners eating here. I don't eat too spicy but found it too be kind of bland ....,Rated 3.0,12,10,??
Ankit Narang,"Rated It is a proper dining restaurant with pretty good interior. I heard that food is awesome prior to my visit and when I experienced it, I was like wow..!! Food was really good but the only thing which made me disappointed was, despite of not being crowded we received our order after 1 hour of placing it.",Rated 3.5,6,18,??
Sheena Chawla,"Rated It was janmashtami and we were looking for a reasonable vegetarian affaires. We ordered for a vegetarian tikka platter,lahori paneer, vegetable biryani and some assorted breads.Nothing great,nothing out of this world.Everything tasted blant and extreamly average.Would I go back again??Naaaahhh Overall review??Very very average.",Rated 3.0,14,74,??
Shikha,"Rated The moderate place for the quick bites as the name says PUNJABI BY NATURE QUICKIE, It is the smaller version of Gastronomical PUNJABI BY NATURE which is known for its sumptuous Chola Bhaturas . Dahi kebabs are good , platters are also Appetizing.",Rated 3.5,0,0,Expert in Connaught Place
Kr Moses,"Rated Really bad experience and service. I had lunch at this CP venue. Drinks were really bad. Major concern- the guy who brought my card after swiping it, threw it on the table.",Rated 1.0,1,7,??
Rajesh Kumar,Rated Do not venture in here unless you love bloated stomach caused most probably by unduly liberal use of soda. In our case 5 out of 5 people who ordered platters got bloated stomach upon eating seemingly light platters. I am not recommending this place to anyone.,Rated 1.5,5,16,??
Jamshed Nassin Kv,"Rated I can't suggest this place to any one.... Because I couldn't find much variety food, also the food which order is not that awesome. The worst thing is the lighting. Yes it is over lighten ,at least remove the bulbs which make dark shadows.",Rated 3.0,6,52,??
Varun Jain,Rated Great service and great food as always. Special compliments to the manager Rajiv who has been with Punjabi by nature for many years. Dahi kebabs are unbelievably good.,Rated 4.5,11,4,??
Kumar Abhishek,"Rated Not trying to be harsh but would not suggest this to anyone . Less variety , a conjusted ambience and a very average food . Had a not so good experience .",Rated 2.0,24,38,??
Tulika Paul,Rated One of the finest restaurants...in CP..with an wonderful ambience and service... I and my friendordered a veg thali(5)...and a chole bhature... Service:very quick Food: awesome...I just loved the items of the thali..chole bhature was too huge for a single person..but simply delicious... We came out..over-full..and that's the best part I love...it's not that heavy on pocket... Waiting to try non-veg...from this same place..,Rated 4.5,13,20,??
Vipul Mahajan,Rated Went there for the first time..i ordered a veg thali No 8 and choco oreo shake..thali and shake were excellent..service and setup is good..prices are not much expensive..little waiting is there which is worth it..recommended for punjabi food lovers..,Rated 4.5,8,50,??
Arihant Jindal,"Rated The restaurant dsn't match the standards of their the one in Rajouri garden. Though the food was fine, the service is pathetic. The waiter came just kept 6 plates and a bunchbof forks n spoons on the table. He didn't even bother to keep the plates in front if the guests. The water glasses were kept at a side of the table. Food quality was just fine. Breads were a little burnt. Mix veg. looked over boiled with a hint of fried okra (which should have been a little more)",Rated 2.0,11,11,??
Mohit Garg,"Rated Veg galoutii kabab is super good....u can give a try to lahori paneer masala...its gud... Moreover, tawa vegetables is also gud... Above all masala papad..nothing unusual in taste bt their presentation of it is quite unique.. Overall a good place to visit BT in weekends, you have wait in queue...",Rated 4.0,6,0,??
Anupam Dixit,Rated This place has taken my heart amazing service by providing right thing at right time. Food is excellent. Dahi ke Kabab and Dal Makhani is a must try. They are not expensive considering quality and quantity.,Rated 4.5,33,86,??
Pankaj,"Rated Ordered Dal Makhni, Paneer Lahori Masala, Meat Punjabi by Nature and Chicken kadhai along with the usual Indian breads. The veg dishes were awesome, the non-veg not so much. But overall a good experience. The ambience was nice enough. The golgappas with different flavours of chutney were cherry on top.",Rated 3.5,16,3,??
Rajiv,Rated So it is smaller outlet of PBN....Really like the concept. We ordered one non veg thali and Chole bhature.... And food was so tasty. Service was quick ...... Great place to have lunch,Rated 4.0,13,41,??
Shantanu Prakash,Rated Tasted super! Nonveg Thali is recommended. The meat one was spicier than I'd prefer. Being right in the middle of everything obviously adds to the ambience! Good time with dad and sister!,Rated 4.0,11,117,??
Ashutosh Shringi,"Rated The place is really popular. Thalis are really worth for. Chaat and other stuff is also yummy. Nice place to have lunch , dinner or snacks.",Rated 4.5,19,61,??
Nabiha Tasnim,Rated Authentic Punjabi food. Their thalis are great value for the buck. Extremely filling and delicious and good sized servings. Love the dal makhni and galouti kabab.,Rated 4.0,10,62,??
Shikha Kapoor,"Rated A much appreciated version of Punjabi By Nature, specially when the original ones aren't serving very great food. The place is situated at a good location in CP and draws huge crowds. The concept is to offer limited menu and focus on quality and service of this limited menu. The food is good, tasty, yummy and the service is quick and efficient. This place also offers a number of platters which are great for people who want variety but do not wish to order full fledged dishes. Overall a place you can go visit numerous times.",Rated 4.0,109,527,??
MOVISH,"Rated Walked in late on a week night.My first time here.Was not expecting anything much.Only that the rumbling in our hungry tummies should subside.Got an unexpected surprise.Almost everything exceeded expectations. Had :Chicken Malai Tikka,was soft n juicy Fish Fingers with Chips -just perfect, not oily at all,fish tasted very fresh.Accompanying Tartar Sauce was the best I've ever had.Asked for a refill. Veg Galouti -their speciality .Delicious Makhni Dal- very flavorful .Must try. Lahori Paneer-Average Rice-a little hard n dry A glass of merlot-Avoid Nice ambience. Good service.Great food.Value for money.Must go at least once.",Rated 4.5,0,0,Expert in Connaught Place
Bariya,"Rated A place for fine dining, punjabi by nature with its simple yet elegant decor makes a fine choice if you want to take a step outside the hustle bustle of CP life and enjoy a quiet, intimate meal. I happened to order a kebab platter, which is not an out-of-the-world experience but yes, it stands average on the mughlai tastes meter, and a biryani, the quantity is wholesome. One, will very easily feed two hungry people. Taste, again, gives you a typical mughlai experience. These two things plus a coke costed me about 700 rupees, which I wouldn't say was a bad deal. Overall, a pleasant experience. Visit if you're looking for a quiet place to have mughlai food.",Rated 4.0,18,24,??
Prachi Singh,Rated Definitely a treat for food lovers. Delicious food served nicely. Virgin golgappas are must try. The staff is courteous and prompt. Thumbs up! :),Rated 4.0,20,58,??
Vinay Sharma,"Rated The food is really Awesome, i had muglai there. And the presentation of food and interior of this place is amazing. But the only issue was that the waiters who were serving the food were also picking the used plates from table after eating that thing i did not like from the hygene point of view but rest of the things were brilliant",Rated 4.0,1,0,??
Ramit Choudhary,"Rated Ambiance is so good, it can be more good if workout in lights. Food is great, dish is perfectly cooked with balance of spices. Prices are slightly high. For two persons it costs us 2400.",Rated 4.0,17,6,??
Apoorva Goel,"Rated As a vegetarian, it is extremely difficult to find good veg kebabs in Delhi which is too proud of the non-veg stuff it rolls out of the tandoor. Punjabi by nature Quickie is the first place I have come across which doesn't leave the vegetarians disappointed. Their veg seekh kebabs are amazingly yum. Must try with their mint chutney.",Rated 4.5,27,421,??
