Username,Review,Rating,Total_reviews,Followers,Expert_level
Naman Vijay,"Rated Erotic drinks & Exotic food.... Great ambience , place worth to be at....... ""One cannot think well, love well, sleep well, if one has not dined well""",Rated 5.0,2,24,??
Facebook User,Rated Poor service spoilt our whole social experience. We had to beg for giving an order. Were made to wait for both drinks and food inspire of constant reminders. The place was not understaffed and in the contrary was overstaffed and inefficient. Drinks were equally un-original and weren't true to even the description. We had to send back 2 of them. The food was at its best average with small portions which were served without any aesthetics. All in all the worst Social experience I have had especially when comparing with other outlets in Delhi and Mumbai.,Rated 1.5,2,0,??
Harmeet Singh Vohra,Rated Excellent place to spend your evenings. You must try achaari fish. We were served by Sumit and chef Nikhil. Evenings are fun and friends will enjoy. They also serve healthy breakfast and lunch options. One of the must visits in CP,Rated 4.5,1,20,??
Harshit Kedawat,"Rated After visiting social cafe in HKV .. I was eager to visit newly opened social at CP in D block near famous odeon pan shop. Ambience of the cafe was nice though it was not awesome like HKV as it has lake view but still it was good with different design. It has outdoor sitting also. Music played in background is also not so happening.. So rating for ambience and music 4/5 Service was quick. One has not to wait for his food for long and waiters respond quickly. So 5/5. Food we ordered was mile high sandwich, Chinese bhel and chilly chicken and in drinks Oreo mud pot shake and lime and lemon iced tea everything was good,delicious and tasty. So 5/5. It's a budget restaurant if u don't have drinks I know that's not possible but its a awesome place.. Shld give it a try...",Rated 4.5,6,26,??
Karan Juneja,Rated So i have visited 2 out of 3 socials in delhi it turned out to b well a totally new kind of atmosphere they got into literal meaning of old school and remind me of my school The food and drinks were awesome as always bt they shuld really add some new dishes and work upon their food menu in terms of quantity and variety,Rated 5.0,19,51,??
Aanchal Walia,"Rated I am a great fan of Social offline.I however keep comparing every new addition to the Haus Khas Village outlet,which is super vibrant and full of life.Comparing to location and seating space this new launch in the D block Odeon Plaza is aptly located and super spacious.In terms of the crowd pull I somehow still feel this place as well as the defence colony outlet would take a little while to reach the level HKV one has already done.However the menu is amazing and the service is really nice.",Rated 4.0,37,149,??
Gurmehak Mann,"Rated Loved everything about the Odeon Social. Starting from the theme, the central location, the staff, the ambience and the FOOD. The Pulled Tandoori Chicken Makhani Bao is an absolute must-have. Visit this place with time on your hand, 'cause once you are here you wouldn't want to leave!",Rated 4.5,7,4,??
Khyati Hans,"Rated Social offline at Connaught Place now. Visited this place three days after it opened. We loved the 'back to school' theme. The interiors, the staff and everything else is about school. The place is smaller than the one at Hauz Khas but still we enjoyed. Food is just amazing! We had vada pao pao, butter chicken biryani, the chilly fries and the main course that we ordered was severed in a lunch box. The oreo mud pot shake and the kitkat shake are just too good, I always order them. The staff is courteous. We loved the way the mangers of that place greeted us after we wrote good remarks for them in the feedback form, which is given to us as a marksheet. Amazing experience!",Rated 5.0,8,2,??
Rituparna Dey,"Rated A new addition to the Social family! Wat can I say about this place.. Fantabulous should do it! Located in the D block of the CP area and adding to the collection of the night out places available at CP, this surely is an exciting addition! The place has ample seating place and a good outdoor seating area as well with great decors! One shud try the nachos and the samosas really tasty. Not to forget the ferrero Rochelle shake! An all an all great place to hang out with frnds. Must go place if in CP!",Rated 5.0,35,55,??
Shreya Srivastava,"Rated Having heard a lot about the Social chain of restaurants, I decided to try this newly launched one at C.P. From the outside, it looks quite small and dinghy, but go inside and experience this giant of a restaurant. The place is huge - bigger than Striker's or Cafe Public Connection. The place is divided into three seating areas - two with smoking restrictions and one for the smokers. Each seating area is in itself a restaurant with unique interiors and decor. There are wooden chairs and tables, couches and sofas. The bar counter is enormous and they have a seating area there too. At each table there is a hanging electrical connector where you can plug in your chargers. The cutlery is placed in a steel glass and the napkin is rolled with Social written on it. They are encased in a box made of yellow wooden scales that we used in school. The servers are polite and they are always up at your seat asking you about food and drinks. They are dressed up in school uniform with their sweaters bearing a coat of arms like Hogwarts. We ordered Spaghetti Aglio Oleo with chutney in a tiffin box, Corn Falafel bao with hummus and Classic Long Island Ice tea. Their quirky presentation is enough to drive you crazy. The spaghetti was served in a steel tiffin box - the kind our parents took to school. The L.I.I.T. was served in a 500ml jar that we used in our chemistry lab. You can actually notice how many millilitres you have drunk through this jar. Anyway, getting to the taste of the food. The spaghetti was light and was topped with cheddar cheese, chilli flakes, shredded coconut, mushrooms and juillienes of French beans. The finely chopped garlic had a prominent flavour in this dish. The corn Falafel bao with french fries and hummus was a class apart dish. The Falafel was crispy and the filling of corn was tasty as well as innovative. The buns or the baos were soft and went well with the brittle texture of the Falafel Patty. The bao also had white sauce and cabbage leaves in addition to the Falafel. The hummus had a very fine texture with the flavours of chick peas bursting in my mouth. Their 500ml L.I.I.T. was the best and the strongest I have had so far. It took a good quarter hour to finish it. Highly recommended. The place is good on the pockets too - optimally priced menu and good portions. Will keep coming back for more! gluttonyguilts.wordpress.com",Rated 4.5,128,980,??
Sainyam Kapoor,"Rated i had never been to any social till today, jus heard about different themes that they have for decor. so this one as all others have highlighted, was school. must say it was done pretty well, the furniture and fixtures, a globe on the corner, swings in the outside area, trophies and books caninet, uniform for the servers. would all make you remniscent about your school. it was a short visit and we ordered croquettish and awesomosas and along with them the accompaniments i.e. chilli and mango murabba, sriraja chunda and green apple chutney. croquettish was nice and cheesy and awesomosas was perfectly fried. but the best part were the chutneys, all three were nicely thought of and hugely enhanced the flavour of the snacks. the only thing which made me rate 2.5 was, the plates that they gave to eat food in, it had the small of rotten egg coming through, even though we got the plates replaced, still i could get that same smell. However, would definitely like to go again with more time on hand and more stuff to try, but mayb not eat anything from there plates.",Rated 2.5,20,566,??
Aakash Chawla,"Rated The much awaited Odeon Social is finally here. Takes you right back to your school days with a School themed furniture and staff dressed in school uniforms (not to forget the big display of St. Marks school :p). The place has a good vibe and was buzzing on sat eve. The service was quick and the staff was courteous although the food was not quite up to the mark. Ordered chinese bhel, chicken tikka tacos and death chicken wings. Comparing with the Hkv social, the food was a bit disappointing. The tacos were good although the portion size was less. Chicken wings were not spicy enough as compared to the reputation they carry. With minor improvements, this place can be one of the best in CP. Overall a decent experience.",Rated 3.5,9,64,??
Shivangi,"Rated It's been such a delight to have Social at CP(Central Location). Though it's nothing in comparison to HKV's Lake view and greenery, but it's based on an entirely different theme : Schooldays. Having wooden seating, reception desk on entrance, typewriters on table, swings and school's board of honour in balcony, service staff in school uniforms with Social monograms, it does complete justice to the theme. You will certainly get a flashback of your school days. We went on a weekday morning, opted for outside seating (Delhi winters) on a comfy, red couch. We ordered : * Oreo Mud Pot : So flavourful,thick and creamy in huge quantity Complete 5/5. * Caffe Latte : bit of disappointment here. Really average. 3/5 * Mile High Sandwich : 3 Layer Sandwich with veggies, cheese and soft patty accompanied with fries and dip. It was huge and delicious but what was the outstanding part of the dish were the fries, probably the best I ever had. So crispy and crunchy. 5/5 for them. *Service was warm and welcoming. There is a reception at the entrance where we were marked present and were taken to our table. The service was courteous and prompt. Will be back to have a proper meal.",Rated 4.5,0,0,Expert in Connaught Place
Ananyaa Mazumdar,"Rated Had early-ish dinner on a weeknight, so thankfully there wasn't any waiting. The service was pretty prompt, the food and drinks arrived in minutes. The toxic LIIT was on point, the Schezwan chicken was a tad bit too spicy, the Barbecue platter and Ferrero Rocher Shake were nice. Extra points for the hipster decor and utilising space well (the HKV social gets too stuffy, which I didn't think was a problem here even later in the night when it was teeming with guests). We asked for terrace seats - which they said wasn't available, although when I stepped out there in fact was space, so we shifted. It wasn't much of a hassle.",Rated 4.5,6,6,??
Yamini Bhargava,"Rated A fake elevator door, with fake otis knob greets you to wooden staircase which leads you to the odeon social, which is the new place in Cp right above odeon, The interiors have an back to school theme. There is a swing outside and a board where name of toppers has been written. Starting with the menu, its the same like hauz khas social. We ordered LIITs which came in a long bong, yummy, perfect. The chinese bhel was good too, But I personally loved the mezze platter more. They had dips and pita, falafel, something cheesy and certain crispy chips like thing. Totally worth the price. The place is a good competition for other places in Cp, as the pricing is same, and music and drinks are amazing. Must visit. Ultimate party destination.",Rated 4.5,20,76,??
Sanju Aneja,"Rated #Odeon_Social - A QUIRKY SCHOOL THEMED RESTAURANT THAT SHARES A WORKPLACE AS WELL #SOCIALOFFLINE has come up with it's third venture at CP and this time it is banking on the ""BACK TO SCHOOL"" theme. Everything about the place will make you feel nostalgic. The wall adorning honor rolls, shields and a class group picture, wooden shelves crammed with old books, a typewriter and phone set of the bygone days and waiters clad in school uniform, all will bring back memories of good old school time. And the best part, they have a work space as well for people who love to work with loud music and great food. They share the same menu as the other two outlets that serve comfort food from different cusines, for every genre. Here, the added advantage is that it serves the Social chhath menu as well. Their bar counter serves abundant variety of drinks that one can enjoy with some lip smacking snacks. I've tried almost everything from their menu at the other two outlets, so this time I went with the theme and ordered 'SAMOSE WITH CHHOLE' to start my meal. Two adequately big sized samosas were served with black gram, freshly prepared samosa tasted good as you don't expect good samosa at such cafes or restaurant. Not a bad deal at Rs. 90 to revisit my canteen days. I satiated my sweet taste buds with their signature OREO MUD PIE SHAKE (Rs.190/+taxes), it was thick and outstanding as usual. CHILLI AND BLACK PEPPER CHICKEN BAO (Rs.210/+taxes) - the soft bao was sufficiently stuffed with spicy shredded chicken, if you want to add some more spice to it, you can dip it into schezwan sauce that was served with it. In a nutshell, apart from good food and reasonably priced drinks, Social packs plenty of charm. Service was prompt. Total bill costed Rs. 638/- and my belly was pack to the fullest.",Rated 4.0,60,575,??
HARSH VARDHAN Singh,"Rated The new school theme is nice here except of the typical social outfit , food is amazing as we expect from our lovely social cafes ,ambience is something new we can find of",Rated 3.5,1,0,??
Venkatesh Shanbhag,"Rated Hey Tushar, Ravi and Gagan....Thank you for all the hospitality extended. You guys are simply fantastic and deserve all the appreciation. Keep up the good work and god bless. Cheers",Rated 5.0,2,0,??
Surbhi Mehra,"Rated After having a great experience at hauz khas...I was way too excited to visit odeon social. I went there on Sunday with my younger sister. The rustic ambience and quirky office like tables just gave it a completely different look. We ordered ferrero roscher shake which looked so tempting along with veg sizzler. We were confused about what to order in desserts, so the person who took our order suggested to go for Chocolate Blood Bath...it was sinful indulgence for chocolate lovers like us...served in the bowl shaped as a bath tub, it was indeed a very delicious way to end the day with. Thank you so much for wonderful service. Cheers!!!",Rated 4.5,30,129,??
Mansi Kukreja,"Rated Was here today! And totally loved the ambience, the food, the interiors and what not// Had there naga chilli toast (suggested by the attender) and trust me you will not regret ordering this yummy dish! I have always loved there shakes and was not disappointed today also.. If it's your first tym and you like kitkat, you should definately take a chill with there kitkat shake! In all it was good to be here :) 4.5/5",Rated 4.5,1,133,??
Neelaakshi Piplani,"Rated After having a horrible food experience in Def Col Social, i was skeptical to try this new Social Venture, but as soon as i Stepped in the premises of the outlet, I knew I was up for something Big and Exciting, the entry from ""lift door"" which instead deceives you to a huge staircase, which was sort of unusual and different. The back to school theme was completely justified by the restaurant's decor and had a ""social's touch"" as the ambiance was raw and very comforting. What to Munch? Hot Tennessee wings-which was juicy and were presented with some onion rings and had a little sweet taste. Awesamosa-filled with jalapeo cheese, deep fried and tasty samosa . Chinese Bhel-It's a win!! You won't realize where it vanished when served on your table. Must Try! Butter chicken Bao-Show stopper dish. The regular butter chicken tasted fab filled in pita bread. WOW Butter chicken biryani-I sound like a butter chicken fan and hell I am! And you will be if you try this. Butter chicken covered with rice and presented in pan with some fryums. What to Slurp? Game of sling- My favorite from their widespread cocktail menu. It was a gin based drink, presented in a sling stand with a #DRNK napkin Cosmo Explosion- Candy floss presented in a cocktail glass, poured with the cranberry vodka mix on top of it with a lemon wedge lit over it. Loved the taste as well as the presentation. For Desert we had Bannofie Cronut- The best presented dish with the worst taste. Too hard to cut. There was a stark oil you could feel as soon as you bite in. This dish needs improvement and attention big time!! Chocolate bath-Compensation for the horrible bannofie Cronut we had. Best for chocolate lovers as it was a mix of all sort of chocolates/brownies with ice cream. The service and the servers deserve a mention. It was pretty smooth. They were extremely warm & welcoming and were trying to live up to the demands of all the people present there. Go Try Foodies!! enticingfoodcruise.wordpress.com",Rated 4.0,0,0,Expert in Connaught Place
Uday Raj,"Rated Amazing place with a school theme. Courteous staff. Excellent food,everything we ordered was tasty and I find it pocket friendly. Their LIIT is a must for cocktail lovers.",Rated 4.5,4,3,??
Aditya Gupta,"Rated The place has a school vibe with trophies , service staff wearing school dress and books all around . The feel is good and food was good too . Alcohol though is expensive but we liked the food . We had Oreo and Ferraro rocher shakes and burgers . The service was quick enough and food tasted good . Not amazing but good enough for us to like it . One time try atleast . Though a bit expensive .",Rated 4.0,0,0,Expert in Connaught Place
Akanksha Sharma,Rated One amazing place! Amazing ambience! Achmed's mezze platter is a must try. And that L.L.l.I.T tower was amazing! Overall thumbs up to this place! One thing they should work upon their music playlist a lit bit.,Rated 4.0,5,7,??
Kriti Chopra,"Rated So we here about their new scheme of buying a beer at the price of Rs. 3/- and that too in Re. 1/- coins!!! Who wants to miss that now! This place is particularly bigger and spacious than its earlier namesakes. Lil slow service for noon but the food tastes great and the presentation just makes u wonder. The portions could be increased wee bit. Good concept, good music and good food. Happy taste buds :) cheers!",Rated 4.0,24,55,??
Vivika Malhotra,"Rated Social offline does seem to surprise you yet again! Placed right in the centre of D block in CP,social attracts you. It's new theme ""back to school"" makes you nostalgic of your old school days. The benches are wooden and the menu card in in the form of an attendance register. The food is the same everywhere which is always great.",Rated 4.0,24,22,??
Shikha,"Rated Odeon Social is a new kid in the CP . I will surely appreciate the effort done to make it look like a Jazzy Amusing Classroom/Library. The List of toppers on the board of St marks school do gives you a good feeling knowing its your Ex School. The typewriters,the trophies, the ruler shaped cutlery tissue boxes are again very innovative.The outside Sitting is Bit compact . The wall of Honour is very Inquisitively putten up. We ordered Let us Wrap with Paneer Satay, Mac Cheese, Few Beverages which included mud Oreo shake, Fruit Social etc. The food presentation is Uber cool giving it a glamzy look . The Servers are quick & responsive .The pricing is perfectly ok with the quality & quantity of Food & Beverages. School Uniform is cool Idea looking into the whole theme of the places but with proper Attire at least Full sleeves Shirt for all the servers out there.",Rated 4.0,0,0,Expert in Connaught Place
Invisible Foodie,"Rated The new theme fares well albeit nothing extraordinary. Food remains somewhat the average. The vibe is uber. Management please have some mercy and get your staff full sleeved shirts, on my second visit for breakfast saw them shivering with cold again! Not cool. (-0.5)",Rated 3.0,89,422,??
Soumya Arora,"Rated Back to school theme is the first thing you'll notice here. Beautifully arranged tables in the form of principal's office,trophies and library in the backdrop,swings in the outer area,waiters dressed in school uniform social will definitely remind you of your school times. Coming to the food, the menu is more or less the same as other social outlets. Must try chinese bhel for starters and death by chocolate for the dessert.",Rated 4.0,39,111,??
Priyanka Rastogi,"Rated Great ambience ...huge place ! True social character .,, classroom setting ! Service is a bit slow ...food is good ! Drinks were yummy ! Happy to see my fav place in CP",Rated 3.5,33,94,??
Ashiishh Kalra,"Rated The Best Place To Be After Social ! Loved the Back To School Theme, Presentation And The Taste! Tried Their Hash Brown Tikki Chaat And Andaas Apna Apna Cheese Omelette Sandwich. Both Were Quite Tasty! As Usual I Had My Liit But Tried Their Trip On The Drip Cocktail Too This Time. Coolest Place To Be Anytime With Anyone.",Rated 4.0,9,420,??
Shilpa Chauhan,Rated I am a social fan... Really happy that it's in cp now because I have to go to cp like everyday.. So we were at odean big cinemas for morning show but were 40-45 mins early.. Now what to do.. On winter morning in cold winds... So we decided to go to social for morning tea (and to kill our time of course!!) Its been 1 week to odean social and I so wanted to have a look here.. Back to school theme.. Wow!! Staff was dressed in school uniform.. Sitting was like school tables and bar section looked like chemistry... overall it will remind you your school days. :) and now food.. Menu was same so everything obviously will taste awesome.. Social never go wrong on taste..,Rated 5.0,29,57,??
Kima,"Rated Its like you're back to some boarding school run by Catholic missionaries estb during the British Raj...superb ambience,menus are same as the other Social outlets....but seriously speaking,its a hole new level of creativity and work done to the interiors...nice work,its always been a pleasure to visit the Social outlets in and around Delhi NCR. Keep up the good work...hope to visit again soon...cheers!!",Rated 5.0,32,98,??
Poorvi Singh Chaudhary,"Rated I visited this place on the 13th for the preview night, an event hosted by the social for bloggers to introduce the newest member of the social offline family! The theme of this place is ""back to school"" and is executed very well. From the school uniform drawn by the waiters and the decor of the place compromising of all the things that takes you back to your school days, such as the trophy displays, the benches, home science lab and completed with the class photographs! Coming to the food, we ordered Sangria, cosmopolitan, corona, Oreo mud shake, Meatballs, Shawarma and Chocolate blood bath. Out of all the things the dessert was the best and followed by the shawarma and Oreo mud shake. What I didn't like were the meatballs It is definitely a go-to place mainly because of the ambience. Talking about the service of the place, earlier because of the commotion the servers were making many mistakes, but eventually, they got a hang of it and it was good",Rated 4.5,27,34,??
Divjot Singh,"Rated Located right above odean theatre and based on back to school theme where waiters are dressed like school kids and seating arrangement based on classroom ,Principal room etc. I kindda like the theme and with good music playing it was fun . We ordered Thai Thalli which is best thai food i have tried in India and it reminded me of meal i had in thai village back in 2011 which is very good . we also ordered Tikka Tacos which was good but not at good as thai thalli. In Drinks we ordered Homemade lemonade (Salty) which was not very good . In general looking at the environment ,theme ,music and food i am very happy with this new addition in Connaught place however wish the portion of food was little more.",Rated 4.0,7,24,??
Anmol Dudeja,Rated Social has always been a great place to hand out with friends and i am sure Odeon Social won't let you down. A very different and impressive theme with decent food adds more to it. Outdoor sitting gives more to its ambience. As we know you get one of the best LIIT's in social and If you are a Chinese Lover - China Boxes will treat you the best. And for immense pleasure wrap up your meal with Chocolate Blood Bath ( it's worth ordering you see ) Cheers,Rated 4.5,8,63,??
Sushant Jain,"Rated New social that too at very good location, odeon. The ambience is nice with a theme of old school. We ordered baked nachos,bombay sandwich and veg burger. The portions were small but the food was tasty. Liit was as good as in hauz khaz. Price-4/5 Ambience-4.5/5 Food - 3.5/5 The main problem was the service that was very slow maybe because of the new staff.",Rated 4.5,17,63,??
Shalini Srivastava,"Rated Was there for a quick bite last week. Liked the back to school themed interiors! Social offline is known for its quirky and out of the box approach. We tried Awesamosa which were crispy and delicious , Tennessee chicken wings were a bit too sweet. Chilli chicken was tasty , naga chilli cheese toasts were slightly chewy but good, I liked the butter chicken biriyani which was nothing but rice layered over butter chicken. China box was good with cottage cheese variant. In desserts only chocolate blood bath was good , the banoffee cronut was so chewy, oily and hard to cut into .. Complete downer! There were some hits and misses but overall it's a good place to hang out with friends with quite an extensive menu. voyagerdiaries.com",Rated 3.5,24,924,??
Abhishek Mudgal,"Rated Social offline finally arrived at the most happening place in Delhi! The cafe is based on a school theme from Waiters wearing school dress, Swing, Charts & a library. Creative! That's what Social is all about. I ordered Fully Loaded Nachos, Crispy sesame Honey Chilli fries, Oreo Mudpot Shake & A ""Thandi Beer"" Totally worth it! Should give it a go If you're around CP. abhishekmudgal.com",Rated 4.0,15,78,??
