Username,Review,Rating,Total_reviews,Followers,Expert_level
Zainab Faridi,"Rated So last Saturday night we just cracked into odeon social for dinner. Well it was jam-packed already with loud music and low light. It made us grooving seriously. Then after waiting for 15-20 minutes, which seemed extra long at such a crowded place, we finally got a place to sit. I literally loved achmed's mezze platter, how beautifully it was brought. Red sauce penne and paneer tikkas were also quite scrumptious. Drinks were chilled and too good. Social has definitely played well with the theme. All over the experience was not bad. Definitely going there again.",Rated 4.0,13,65,??
Balkirat Singh,"Rated We went to this newly opened #Social outlet in CP after watching a movie. We had pre booked a table for 6 PM and the place was jam packed. The downside was that the management did not honor the promise of providing a decent table even after me ensuring the table reservation 3 hours in advance. We were made to sit outside where just a single table was there and also opened to smoking. Then after making several request we were seated inside on one of the table. But after this initial downside, the whole ambience and innovative menu offerings cheered us up. We ordered Samosa with Cholley which was served in a tiffin box - thumbs up for presentation and taste. Also ordered Chinese meal box which had a generous portion - paired with a Green colored Khus and Chilli Mocktail. The evening was ended with a Chocolate Blood Bath dessert which was the winner. The overall experience was good if not better. Will head next to their HKV outlet and see what it has to offer.",Rated 4.0,34,282,??
Neha Gupta,Rated It is a place that takes you back to the school days as everything including the interiors have been designed in such a manner. The food makes the pallate happy. I would love to visit the place again and would recommend it to everyone.,Rated 4.5,9,1,??
Akanksha,Rated I went on Satrday to Odeon social. And there was waiting fr 20 mins. But i saw d ambience nd it was really cool.. the waiters nd waitresses were in school uniform nd all! Also the food was okayish but d Ferrerro rocher shake was d best!,Rated 3.5,32,14,??
Vrinda Vig,"Rated This place is just too good. The school themed interiors, waiters in school dress, wall with shields.. Everything is just perfect.. So we basically went here for desserts. We ordered Oreo mud pot and layer cake. Both were amazing and a must have.. Overall a brilliant experience.. Food :4.5/5 Service 3.5/5 Ambience 4/5",Rated 4.0,11,7,??
Rahul Yadav,"Rated I went for the Sunday brunch with my bestie to this. Frankly had no idea about this place and I didn't see zomato for the ratings before I entered here. My friend highly recommended this place and this was the closest place. Ambience in the place is not the best. But we were fortunate to get a good seat and so the ambience was not the issue. Music is terrible, seriously they need to update the playlist. Plus the song selection was pretty boring and uneven and so that was a dampener Food : Started with the guava peach punch, and I will remember it for the rest of my life. Not because of the taste but for the combination. Guava, mint and chilli are not the best of combination but I was still better than some of drinks I have had at fancy places. However a refreshing change. We ordered Tikka Tacos - which were good. The tacos were good and the tikka chicken inside it was properly cooked and served hot, which along with mint chutney was a delight. Also ordered a cheese bread toast - forgot the name- which was way too cheesy. I am not a big fan of cheese so I tasted only one and it was terrible for me but the texture was good and the bread was crunchy, so it was probably my hate of cheese which made it worse. My friend seemed to enjoy it a lot and so I would rate it good. My friend suggested that we tried the Biryani for here so we tried the Paneer Makhani Biryani. The rice was cooked properly ,however the biryani fragrance and feel was missing somehow. The blend of Paneer was thorough and props to them for making me eat Paneer twice. The dish left no bad aftertaste and the palate felt good while eating. Service was good. We were served the orders in time and there was no unnecessary wait. The service outfit was kinda school themed which was pretty wierd Will visit it next time for some new try outs",Rated 3.5,52,237,??
Charu Garg,Rated Amazingly awesome place.. Good music.. Nice crowd.. Thank god they r nw open in CP.. We ordered quarter scotch.. Mezze platter n fish n chips.. Food was just awesome.. Best mezze platter ever had.. The interiors are so cool.. I really liked their desi style of serving food n stuff.. Bt the sad part is they dont serve hukka..,Rated 5.0,1,16,??
Rohini Gauba,"Rated With 'Back to School' basics, Social has played well with the theme. Wooden staircase, shields displayed on one of the walls, swings in the balcony, scoreboard for the toppers and a lot many detailing with the furniture. The school environment from the 80's-90's has been re-created pretty well. Servers dressed in School Uniforms approach with tablets in their hands to take your orders. When I went to Social on a Saturday evening, a bit of retro music was being played and a group of people were dancing in one corner. The menu is exactly the same as HKV's social. Vegetarian Mezze Platter: To be really specific, it is meant for three people. Pita Pockets are served with Falafels, Hummus, Tahini and a few other other Lebanese delights, all three in number. Fully Loaded Nachos: The quantity has been reduced but the quality remains the same. Cottage Cheese & Capsicum Sizzler: This has always been my favourite, chunks of paneer are tossed in a spicy gravy and goes well with the rice served along. Slices of Zucchini and Bell Papers are left to sizzle. To pacify the heat, french fries are also served. Chicken Baida Roti: Minced Chicken is cooked and stuffed in a dough pocket and then deep fried. Comes with the green apple chutney and is an absolute delish. Iced Teas speaks volume about the place, they are absolutely refreshing. You should definitely order this, served in a little bath tub, these are pleasing to the eyes. Strawberry Cheesecake Shake & Ferrero Rocher Shake are my recommendations. I can easily think of going to this place all alone and spend a few hours. A must-visit! Happy Eating!",Rated 4.5,0,0,Expert in Connaught Place
Alka Sharma,"Rated 7th Feb 2016- Already been to Odeon Social twice, once on 26th jan 2016-it was completely vacant with just 3-4 tables occupied. Then on my sister's bday on 1st Feb, the taste of the food is same as HKV outlet-hit or miss ! The second time,it was a weekday- few more tables were occupied than the last time. The major Cons that I would point out here is that firstly, the LOUD MUSIC WAS TOO DEAFENING THAT WE COULD HARDLY TALK TO EACHOTHER-by the time, we were out - My voice was already hoarse from shouting. SECONDLY, all the cigarette smoke was entering inside. WE HAD TO SIT, SMOKING PASSIVELY FOR THE ENTIRE DINNER -lasted an hour or more which made the experience horrible for all of us. Same was the story at HKV, it seems that the social management only wants to cater the SMOKERS or promote passive smoking. INSTALLING AN AIR CURTAIN on the door leading to the outdoor sitting would have helped n non-smokers can have a easy time without worrying about inhaling the cancer-stick fumes involuntarily.",Rated 2.5,0,0,Expert in Connaught Place
Divit Mishras,"Rated It's just a few steps up the stairs and you're welcomed back to the good old school days. Social offline is now open in CP. Ambiance: This place will remind you of your school,be it the staff dressing, the posters, the human skeleton or the the swings. The seating is not that comfortable though. Food: There is nothing new about it. It's all the same except it's a bit cheaper than Hauz Khass Social. Service: its slow. You've got to wait a bit longer now.",Rated 3.0,25,137,??
Arindam Das,Rated Checked in this morning to have breakfast. Tried the Hardy 's Bhai ishtyle & Sid's posh breakfast. Also had the blueberry pancake. Food was amazing. The place is new and ambience is great.,Rated 4.5,1,40,??
Kartik Bajpai,"Rated This place is full of energy. It's the perfect combination of great food, amazing drinks and great music. The must have's for vegetarians here being, paneer makhni biryani which is out of this world. Another good dish to try out is the Achmed's Mezze Platter, especially the Cheese Awesamosas. The Oreo mud pot shake is also a nice-filling drink to kill your hunger pangs and get yourself on to the dance floor. They have a nice-exhaustive bar right next to the dance floor to keep you going. All-in-all, a highly recommended place, which's value for money, and won't burn a hole in your pocket. The only thing missing is a hukka (sheesha) menu, which would've made this place 'the' place to hit always. But I'm not complaining.",Rated 4.0,6,44,??
@ Foodie Prerna,Rated I went to this place today.. It's theme is actually nice.. Back to school.. I met my school frnd after a decade and the place goes well with it.. Food 7/10 Service 8/10 Ambience 9/10 Will be back soon!!,Rated 4.5,35,733,??
Komal Bhatia,"Rated Went there on a Friday night. It started with waiting time of 30 mins. We choose to wait in the Bar section where we had to stand as strangely they don't have chairs near the bar. Major turn off was over loud music which made it impossible for us to talk. Service was under average as the waiters didn't remember what was the order at the time of billing. Also, our seat was allotted to someone else while we were out in the smoking zone. Mismanagement at its height. I guess Haus Khas Social is the way better.",Rated 3.0,5,49,??
Jayita Mehdi,"Rated First impression : Huge place with great happening music and ambience ! Coming to the food, very good... Everything had such good flavour..... We tried the southall fish and chips ( crispy on outside, soft on the inside), chicken China box (spicy but yum!), masala cheese pao (really good), chilly paneer (yum), non veg slider (average), bbq chicken poutine ( awesome, great flavour), chicken pasta in white sauce (nice)",Rated 4.5,15,38,??
Rohit Kumar,"Rated The food is the same as all social. Just the drinks menu has been squeezed,dont know why. All in all not the best social. They need to improve themselves.",Rated 3.5,9,80,??
Manavv Piplani (Bribing Stomach),"Rated The new social at odeon launch was on the verge and I got a chance to check it out before it opens.The location is amazing and easy to find,the interiors is done on the theme of BackToSchool and social has done complete justice to the theme by keeping it raw as social is known for. So being on exclusive preview we got their recommended dishes, Awesomosa was nice and crisp,fried with mushroom and cheese stuffing,loved it. Chilly chicken nicely cooked chicken presented with chopsuey over it. One of my favourite. Chinese bhel something new as expected, and pleasantly tasty, a must try. Butter chicken Biryani,as the name says interesting and worth giving a shot,you will love it if you are a punjabi Fish tacos,tacos with crumbed fish fingers was finger liking and mouth watering. Chocolate blood bath,this desert belongs to all the chocolate lovers,it is basically mixture of all the chocolate and is quite tasty. Heaven for chocolate loving people. Strawberry ice tea,just out of curiosity I ordered it but was very yummy and I loved the refreshing taste. The service was very well handled by the staff, It was quite a busy place but still the staff did a great job. They served us well and made us feel very comfortable.",Rated 4.5,0,0,Expert in Connaught Place
Sidhant Ahuja,"Rated Odeon Social is located next to Big Cinemas .The entrance of the place is quite a mystery a lift door opens and then is the old wooden(Back to School) staircase. Occupying the first floor which is further divided in two parts a small rectangular terrace(which can be thought of an activity place as they have swings)and the indoor part. The rustic furniture is reminiscent of the good old school days. They have a wall dedicated to the trophies and the signboard outside the kitchen reads Home Science. On the whole a lot of thought has been given to the interiors of the place. But the food was definitely not upto the mark.Tried the Chili cheese toast.Just an average toast with cheese nothing great about it. Even the Ferrero Rocher shake wasn't good.It was not the regular one which I generally drink at the hkv outlet. Then had the electric blue LIIT which was okay. The awesomoasas were good though,Thin golden brown fried sheets wrapped in cheese and mushrooms this dish was amazing in taste. On the whole the decor of this place is going to make you come again but the food and the drinks are nowhere near to the hkv outlet.",Rated 3.5,0,0,Expert in Connaught Place
Vipul Mittal,"Rated Thr theme here is that of a classroom, with the servers dressed as school boys. Their seating wasn't the most comfortable but yhe ambience was nice. The Jalapeno poppers were cheesy and delicious, the burger with the Paneer patty was quite average. We tried their Oreo Mudpot shake and it's one of the finest shakes I've ever had. I was drooling all over it. The Ferrero Rocher shake wad mediocre. The sizzler was decent, nothing about it that stoof out really. All in all we had a good time and this place is worth trying amongst the myriad of outlets in CP. Bon Appetit!",Rated 4.0,108,434,??
Mani Kwatra,"Rated Not sure how I can explain this restaurant. It's better to go there Nd experience the food. Never had better. Beautiful house, polite and nice staff, amazing food, and some incredible presentations.",Rated 4.5,12,62,??
Charu Goyal,"Rated Back to school theme was amazing. Tried their samosa with chole from indian menu and chole is a must try. Chinese bhel and panner tikka were good too. Overall, it was a nice experience.",Rated 3.5,2,15,??
Aman Khanna,"Rated Amazing food and concept is totally diffrent from others restaurant . Cooperative Staff and Management also. Mr. Puneet was nice person in Social Odeon given us nice hospitality and warm feeling. Regards, Aman Khanna",Rated 5.0,1,0,??
Puneet Sharma,"Rated Well I happen to visit the social @ odeon cp. The ambience was nice and the ppl(attenders) were full of energy ..some how the food could not leave the mark which the ppl at the SOCIAL did... I ordered a salad ""beetroot and pear salad."" And I could taste the strong endeavour of the chef trying to bring the American flavour on the table but it was a big fail.. It was too sweet. While ordering I thought the salad would be raw like a 'salad' salad, and it was nothing but a complete disappointment ..however I still recommend that one goes to this caf for not just the food but also the lovely ppl who looked like enthusiasts in their endeavour of giving the service everyone expects at a place like this...overall I would suggest be careful with the while you order something new from the menu.. Rest all I can say is that if the salad I ordered was any better it was a perfect 5. :) kudos to SoCiAl@ odeon",Rated 4.0,1,0,??
Naman,Rated Solid stop for a chill drink. Chat with the bartenders a bit if you're unsure what to order. Their own cocktails are a bit pricey (as is the rest of the city) but they're tasty. menu bites are also solid choices.,Rated 4.0,10,50,??
Alisha Beotra,"Rated First things first, or rather, nice things first, this is coming from an ardent Social fan and I absolutely loved the place right from the moment I entered. The staircase, the rules notice right when you climb the stairs, the tables, everyone in school uniforms, the outside space, the swing there - it was all so pleasant and refreshing and so thoughtfully done! I don't want to go too much into the details since you should have some surprise left for your first time too. I went for breakfast and ordered my signature Oreo mud pot shake with Kiran's breakfast I think which consisted of eggs, bacon, pancakes, Oreo 'cookies' and coffee. I've been having the Oreo shake for 1.5 years now and I'm pretty sure that I can make out the difference if it isn't, say, 'authentic' enough. The looks were the same, outstanding as usual, but the consistency wasn't shake-like at all. It was too light for a shake, like Oreo bits mixed in milk handed over with a cute whipped cream topping. I was more excited about breakfast and the whole ambience then to care about this, but maybe I should have. Pancakes were alright, bacon good, the omelette pretty great with an adequate amount of spiciness as I required. What disappointed me was the 10 bucks Oreo pack given as 'oreo cookies'. I'm sorry but please feel free to remove this Oreo 'cookie' thing from the menu because it brings people's hopes high as they imagine some fancy baked Oreo cookie coming their way. Another drawback - the service was tortoise-paced. Overall, what would have been a 4 or a 4.5 has gone down to a mere 3.5 because of my average at best experience. This makes me really sad because of the sheer love I've had for Social and the food and service it's known to provide!",Rated 3.5,57,370,??
Isha Dara,"Rated I have been to Social offline before and since I have heard about odean social, I have wanted to visit. We sat outdoors and loved it there. The interiors are amazing and I loved the bar area. I kinda loved the furniture and the lights. We ordered a cocktail, I guess it's called trip on the drip, it was average and had dominant flavour of vodka. Minced chicken with baida Roti tasted quite good with the dip they served it with. Coming to the dessert, we ordered a layer cake served with hot chocolate sauce and it was absolutely amazing. Only it was a little hard so couldn't break it easily, but, tasted perfect. Good service and courteous staff. But had higher expectations of the food so a 3.5 :)",Rated 3.5,8,3,??
Madhavi Moni,"Rated Too much noise !! Although their menu is impressively varied, the taste is not impressive at all. Somehow didn't get the school theme and was uncomfortable with the servers dressed in school uniform.",Rated 2.5,23,50,??
Ramita Chatterjee,"Rated Went to Odeon Social recently. Went twice this week actually. Went on a Sunday for breakfast and ordered the Saddlebags. And damn, those pancakes were perfect. Then went for lunch on a..Thursday. Ordered some Groundhog burger and Fish and chips. The batter on the fish was amazing. And the tenderloin patty on the burger was cooked a perfect medium rare. Really good place to chill. But they should change the music they play in the afternoon a little. Jazz and blues would be appreciated to create a chill vibe. Also the rate/comment card has a black background and stars so I feel like I have to color in so much. See ya guys soon!",Rated 4.0,14,102,??
Saurabh Malhotra,Rated Very nice place to go....i was there yesterday with my girl....great interior and ambience....lovely music....and the best part GREAT FOOD too... A must visit....,Rated 4.5,1,69,??
Prasidh Prasad,"Rated An inside peak at the new social,its unlike any other social in terms of the settings but the service and food are like all other socials (awesome) Thank you to the head of operations(saurav) ,manager (Abhiskek) and bartender(Amit) for letting me shoot. Check out the link below(copy paste in your browser if it doesn't work),link posted using the instalively app.. https://youtu.be/dpIqqmTqiy8",Rated 4.0,1,14,??
Jitesh Foodaholic,Rated When I visit the place on Launch it was So full didn't enjoyed the food and Drinks But today I was here for Drinks It is totally diffrent the ambience crowd food cocktails Yummm Don't know where to start and where to end,Rated 4.5,13,57,??
Shashank Mehra,"Rated First time here and I most definitely will be back.Had an amazing time! Came late on a Saturday night with a group of friends, so I didn't get to try any food, but drinks, yes please! Place was packed but not overly packed, servers were awesome. Loved the music, loved the decor of the place itself and had a great night :)",Rated 4.0,9,79,??
Adeel Ahmed,"Rated Was very excited about the new Social outlet in CP. The staircase leads to a big school bell which would instantly take you back to the school days. The 'Old School' theme is reflected on sitting, arrangements, decor, and staff. Thoroughly enjoyed it.",Rated 4.5,7,22,??
Ashwani Gupta,"Rated Social in C P was in my wish list for a long time, finally i been there on this Monday the place was completely jam packed. It was full on day like Monday.. Place they made like the next level of hospitality in terms of Ambiance, Food, Services and last but least the music was fabulous.. Ambiance is just like Wow.. No doubt they have done a fantastic hard work over the theme and it is one of most fancy Social they made till now. Service is awesome, Team is good and well trained and courteous.. They were keep on suggesting the most selling dishes which was really good..And the staff specially Mr: Sant Avinash is fantastic he is really good and decent.. Food: i must say they should do something about the quality of food. Honestly i didn't enjoy the food, i ordered Death wings ,fully loaded nachoe's , laal maans pao and southern spiced chicken burger.. In all that i liked only and only the pao dish... The quality of wings was not good at all.. and burger was also not juicy as it should be.. In total it was a good experience Ambiance : 4.5 Food : 3.5 Service : 5",Rated 3.5,16,26,??
Anuja_s,"Rated A name that didn't live upto its name. You know you have gone their to spend time with your friends, but that doesn't mean you have all the time for your order to show up. 45 minutes for just 3 drinks and 2 kinds of snacks to arrive, definitely doesn't make a great image. Orders making to the wrong tables was quite a common affair that day! Probably not a good day to Socialize ;) Ambience : 7/10 Food : 6/10 Service : 5/10 Value for Money : 6/10 But, thank you Odeon Social for the complimentary dessert at the end to cover up the delays and goof ups with the orders.",Rated 3.0,8,32,??
Munmun Aggarwal,Rated Food here was good but oily. Interior is given a nice touch. Loved the sandwich and oreo mud shake though it was too heavy. Will come back soon.,Rated 2.0,4,3,??
Ritika Vaswani,"Rated Its been a long since i wanted to try a social outlet. And finally got a chance to try this outlet of them on saturday afternoon with my friends. The ambience is great. Their theme related to school is totally all over it. You will see it in every thing of theirs. The servers were dressed in school uniforms, the medals were placed on the wall that were making every person there remember their school days. The service is good. The presentation of the food is fab. Coming to the food and shakes- Oreo Mud pot Shake- This was one of the best oreo shake I had till date. And the best presented shake in Delhi. Loved the way it was. A must try here. Ferrero Rocher shake- This shake was again amazing. Thick shake with one Ferrero rocher on top. this was also presented good. Fully Loaded Nachos- Nachos were good. They were baked properly and served with lot of cheese on it and salsa sauce. It was a good one. The Mile High Club Veg Sandwich- This was presented like a tower with one sandwiches over one another. The three sliced sandwich was a really good and tasty sandwich I had after so long. The fries served along with this were crispy and yummy. Penne White Sauce pasta- This pasta was just ok. Didn't liked it much. But this was again presented well, it was presented in a tin tiffin box. totally going with the theme. Definitely going back here to try especially there non-veg dishes. totally loved the place. Its a must visit.",Rated 4.5,68,175,??
Prateek Barar,"Rated I came across this place while searching a new place in cp. The place is nicely done, right from the interiors, the furniture, the accessories on the table remindes that we are in a school which is really good in a different way. Now coming to the food,though presentation really won my heart but I found the quantity less . We ordered tikka tacos, baida roti n chicken tikka n everything tasted good. In fact the chicken tikka was served on a small grill which kept it hot for a while at least. A good place to sit & socialize.",Rated 4.0,67,169,??
Akanksha,"Rated Social at CP is an awesome place to hangout with friends, drink, eat, laugh and have fun. The food tastes good, drinks are good and the music and ambience both work together leading to a fun filled evening. The only negative I could find is that it's a little expensive and the taxes you pay at the end are huge. Still, it is better than a lot of places in CP and I would definitely go back for a visit again.",Rated 4.0,14,6,??
Rahul Bansal,Rated It was an excellent experience there. You wouldnt be disappointed with the expectations if you are visiting social odeon after in hauz khas or def col. The service was good and food is as usual awesome,Rated 4.0,12,27,??
Pranshita Kohli,Rated Visited this for the first time loved the place food was good and proportions were good and pricing was reasonable . The place was full but we managed to get a seat and waiting wasn't long,Rated 4.5,25,45,??
