Username,Review,Rating,Total_reviews,Followers,Expert_level
Sachin Bobal,"Rated Odeon social is the new addition to the social legacy. From ambience to food to service to the entrance as well ,everything was just mind blowing. The servers wearing school uniform and the mark sheet board definitely takes you back to ur school days. The service was fast and efficient. Ordered: a glass of Sula satori Merlot Malbec ,cheese Masala pao,chilly paneer black pepper box,shawarma wrap,yo mama. Chilly paneer black pepper box was excellent. The sauce was perfectly made. Shawarma wrap was delicious. Garlic mayo and fries were the stars. The masala used on the fries reminded me of fries from McDonald's. Cheese masala pao!!lip smacking is the correct word. Loved it to last bite. I was full but still couldn't resist myself from finishing he dish. Overall it's an amazing new place in cp and a must try.",Rated 4.5,78,494,??
Gaurav Verma,"Rated Odeon Social is the newest addition to already crowded market of cafe, bars and lounges in CP. The newly open joint lives up to the expectation of Social franchise. The ambience is different not only from other cafes and bars in CP but also from other Social outlets. With decor theme of back to school seating options are available either on table with big typewriters and bench style seating. In the outside area there are two swings which actually take you back to the school. Now coming to menu, they have good options out there in food and drinks. The special back to school menu is offers value for money. We ordered the Famous Social Margarita, which comes with an ice candy though flavours mentioned on menu were not available and Hajmola shots. The drinks were innovative and were made nicely. In food we ordered Mezze Platter which was good for three people, China box, which was decent take on noodle bowl and twist on a tikki from their back to school menu, which had right flavours with hash brown and wasabi raayta. Coming to service, well everyone around us was being served pretty quickly but guess there was something wrong with server at our table so will discount that part. Overall, a nice place to hangout.",Rated 4.0,14,185,??
Gaurav Prakash,"Rated After listening to great reviews about the newly opened Odeon Social, I decided to give this place a try. I went here yesterday with a friend of mine. It's easily accessible, located just above the Odeon BIG cinemas. Or just in front of the Famous Odeon Paan wala. Ambiance and Interiors: The place has an automatic door to start with. Classy! We went upstairs and it was a nicely lit, school themed restaurant and everything around you will remind you of school times. the walls, the antiques placed at different places give the place a really good feel about it. I didn't like the music much but it wasn't that bad, either! Even the tiles in the washroom are printed with charts we used back in the school days ( how to keep villages clean, etc). The outlet is huge. Like really huge! And they have a corner where you get Hanging charging ports. I found it really contemporary and next gen. Kudos! Check the pictures for more understanding. Crew and Menu : I found the crew really responsive and happy to help. It felt like they were trained to care for the patrons. A crew member escorted us to a 2 seater table and another one came by to check how we liked the food. The service is quick and it's a pretty nice effort, overall. Not to forget, the crew is dressed in a school uniform. And they are happy to get clicked with! The menu is pretty exhaustive , though the veg options are farely limited. Cannot comment on the alcohol part, since we din order any. Food : Let's come to the main part now. The service is reasonably quick. We ordered the Ferrero Rocher And Odeon Social Shake and i found the shakes really good. The quantity, not so much. I feel it's too less for 190 when compared to the shakes i have had in different places. Also, the shakes come paired with two wafers, which is a okay sort of combination. We ordered the Paneer makhani biryani and it was really delicious. It was a perfect quantity for 2 people and came with curd raita and Indian fries! I would rate the preparation and presentation a 5/5. We also ordered the Penne Pasta in Tomato Sauce, It came in a box and was good. I liked the biryani more, though. But my friend liked it since he's more of a pasta person. We clicked a few pictures of the property which you can check with the review . Overall, it is a reasonably price place(except for the shakes) and i feel that it doesn't really cost too much for such a good time! I had a great time and i look forward to coming back Overall 4/5 Cheers!",Rated 4.0,0,0,Expert in Connaught Place
Vikas Joon,Rated Finally went to odeon social and yes it was amazing experience. First of all thank you manager - don't remember his name but he was check blazer thank you for your sweet gesture and service not only him guys being bar and serving on table every single person was so sweet and caring listening to our order carefully getting things on time it was total 5 star treatment and this was on weekend when its completely crowded. Hats off Will not say anything about food and drinks as social has been my favorite place and whatever you serve has always been liked and loved Music was amazing too and classroom feeling was too good Will be back soon Also you guys please come to Dubai soon,Rated 4.5,24,151,??
Amar Sirohi,"Rated When i got to know that an outlet of social has opened in cp, i couldn't resist myself from going there. Situated in the Odeon building under the big cinemas it is a big big place which has both indoor and outdoor sitting. It has the high school theme, the school uniform like dress of waiters, wooden chairs and tables with typewriters and telephones, trophies cabinet, ruler printed holders..even the utensils..everything will remind yu of your school days. Be ready to experience nostalgia. Full marks to the creative mind behind it. I spent only 20-25 minutes here as i had my movie show so I ordered jalapeno mac n cheese with parmesan crust, which was unavailable. Then i asked for Bombay bachelor sandwich, which tasted like vada paav. It was good but had something lacking..and was a bit dry for my taste. It could have been better. This rating is mainly for their interiors and service..i'll come back here soon..will try few more dishes and will update this review.",Rated 4.0,0,0,Expert in Connaught Place
Akhil Chugh,"Rated Visited on Monday night with my colleagues and the place was reasonable packed considering the day. The place has perhaps the best and fastest service I have ever seen in Delhi. Hats off. They were sending out stuff from kitchen as speeds that could put fast food restaurants to shame. The food itself was decent but not great. Menu options still remain limited and the portion sizes were small, typically good for 1-2 people. The Goan prawn curry and Sharwaman platter are worth a try. Stay away from the Parsi options in the menu, they are pretty average.",Rated 4.0,43,121,??
Aarti Ahuja,"Rated Another social ticked marked but the small stomach and friends Tuesday sentiment kept me away from non veg delights. The wonderful staff helped my friend with the selection of vegetarian options, we went along with recommended chinese bhel and potato skins Chinese bhel crispy and crunchy but when street food goes upscale and hygiene flavour of the street dirt goes amiss. The manchurian balls were a bit small but as it was in the munchies section it could be a bit bigger. Potato skins with three different kinds of cheese, totally well cooked but lacked the chives flavour and could be more crispy on the outside. It cut through like ordinary boiled potato no sound of the crispy skin rustling along the knife. It can be served with salsa and sour cream adds depth to the cheesey flavours. Well I will have to be back for sure to this social as well, it seems social will make me social again Keep it up",Rated 4.0,40,461,??
Nitin Agarwal,"Rated Good place - nice ambience, drinks are good, and food is also very good.... Service is fine... Enjoyed time at social... Surely can be visited again!!",Rated 4.0,53,163,??
Sahil Arora,"Rated Social!! I love this place, everything about it is fun and different be it the food, drinks or the decor. Odeon social has gone with the 'back to school' theme and they have nailed it. The food and drinks are the same as at any other social but they do have a small new menu that include a few new cocktails as well. I must say that social is the only place that is capable of making and maintaining a good standard for their cocktails. I must recommend old monk kala khatta and old monk jal jeera (spoiler alert: they are served in banta bottles). For food we just ordered a shwarma platter which was good too. The service was quick and prompt so you wont have to worry abt sitting idle waiting to order. To sum up i would say definitely visit the place, its social after all....what cld go wrong!!",Rated 4.5,7,1,??
Aaron Bhajan,"Rated Lovely space and very innovative drinks ... Hajmola shots are a must try ... They also serve some mixology in traditional lemonade""banta"" bottles .. Which is a lovely innovation.. Food is good and quantity is decent as a pub should have. Classy ambience... Loved it ... Jam packed evenings n decent music to njoy",Rated 4.5,38,63,??
Meenakshi Srivastav,"Rated It was Valentines Day Eve when I popped into this place. It is located just in the heart of Connaught place. As I entered this place, I was mesmerized by the ambience, it was simply wow.... DJ was playing rocking songs and the crowd was dancing on the tunes. This place flaunts school theme with trophies, pencils & rulers etc. It has a huge open & indoor sitting area with varied seating options including swings (Jhoola). Before coming to this place, we also tried some other restro-bar but due to Valentine Eve they were failed to accommodate us. So, as decided, it was our second option for Valentines eve. As we reached here, despite the busy hours the Manager & staff were very prompt in providing good service and managed good couches/sofa for us. We ordered LIIT & Sangria with Southall Fish & Chips, Crispy Sesame Honey Chilli Fries, Jalapeno Cheese Nads, Sriraja Paneer Chilli, Chilli Chicken Rice, Kerala Coin Parathas & Chicken Baida Roti. They took hardly 10-15 minutes and everything was on our table. The food was Scrumptious, crispy and yummy. We tried the following:- Kerala Coin Paranthas, these fingers licking Coin Parathas were topped with Lal Maas, Sukka Chicken and Paneer. Jalapeno Cheese Nads, were stuffed with Cheese & crushed Jalapeno and very creamy & yumm in taste. Toothsome Chicken Baida Roti, stuffed with sumptuous minced chicken (served with green apple chutney) They served Southall Fish & Chips with sauce; they were very crispy & juicy. Sesame Honey Chilli Fries were sweet & sour in taste. Sriraja Paneer Chilli taste was something like Chinese Chatt and delectable to taste buds. Chilli Chicken rice was just awesome in taste. The staff here is quite courteous and service is also good; especially one of the members of their staff whose name is Sumit was very active & prompt as he made all his efforts to serve us the best. One word for the place fantastically amazing. Be there and enjoy. Highly recommended.",Rated 4.5,0,0,Expert in Connaught Place
Alishan Raza,"Rated I visited your place yesterday for valentine dinner....Awesome experience, staff were awesome....Specially Puneet Singh R.M. Keep the sprit up guys....All the best. Regards Ali",Rated 5.0,1,9,??
Shivi Khandelwal,"Rated Fine interior decor, amazing music, perfect couches, great location and good food. This is how how will summarize my experience at this outlet of social. Tried their Ferraro shake, sandwiches and hakka noodles with chili sauce. Although didn't like the sandwiches but other two were really good. A must try place :)",Rated 4.0,51,210,??
Sheena Kaushik,"Rated I happen to visit this place on last thursday and it was my friends bday so it was a special day for me.I reserved a table and was given multiple options to choose from as per my comfort. Location & Ambience Located in Odeon building its very easy to locate in the heart of delhi CP.. Its based on "" school theme"" and interiors are well done..from old shields, to typewriters to home science halls you will get to see it all here..I loved using pencils.. All my apprehensions about this place went for a toss as i am a regular visitor in Social Hauzkhas. After a few minutes waiter very warmly asked me if i need any help in selecting menu and explained me all vegetarians available options. Food In starters we ordered Cheese Nachos and french fries along with Electric LIIT and beer. They have good variety of domestic drinks also available in stock unlike other bars in CP where the standard reply is ""non available"". We liked starters as well as variety of drinks like "" rum kala khatta"". Their drinks and food in all respects is amazing and staff is very helpful and warm. They helped us in my friends bday cake cutting as well. They have a separate smoking area/outdoor seating for ones who like to smoke. We got a chance to meet the restaurant manager "" Abhishek"" who not only ensured he met us, took our feedback but he also served us complimentary "" pan pasand"" shots on occasion of my friend""s bday. Thanks "" Abhishek"" for the lovely gesture. Food -4.5/5 Ambience -4/5 Overall-4.5/5 Loved the place and its now one of our favourite and i m certainly looking forward to visit again.",Rated 4.5,5,35,??
Nakul Khanna Aka CorporateGypsy,Rated The restaurant is based on 1st floor of legendary odeon! It's the hottest place in CP right now. From the menu to crowd to service everything is awesome and worth trying. The only issue that you may face is too many walk-ins. Plan your visit carefully; book a table first. Try LLIT and sausages; both are nice.,Rated 4.5,63,190,??
Rohan Vivian,Rated Great Concept... The whole school thing makes u Nostalgic... The Tables are Arranged as in Library. The place is something to look out for... The best thing is Rocher Ferrero Shake is AWESOME!!!.. Beer Costs around 100 Cocktails Start at 260 Tried 'Screw Social Driver' and it was pretty well Served in a beaker Must Visit Place in CP.. The drinks not so costly... :) Loved it...,Rated 4.0,7,8,??
Nagma Dhingra,"Rated I really liked the back to school theme with all the trophies, pencils, rulers and school uniforms. The place is cozier in comparison to Hauz Khas Social. The service was quick.",Rated 4.5,12,93,??
Shreya Saxena,"Rated Social just nailed it with their ""back to school"" theme. Absolutely loved the decor and little board of St. Marks, Meera bagh in a corner rekindled the fond memories from my first school. The music was a little loud for my taste but the tracks played gelled well with the ambience. The food served is drool worthy and totally value for money. Full marks to the extensive menu (from every corner of India) and innovative presentation. Tried chicken biriyani and baida roti and absolutely relished the delicious flavour. Odeon social is now officially my favourite hangout place with the lively atmosphere and pleasant staff. Reccomended if you plan to hangout with friends/significant other and have a long relaxing chitchat",Rated 4.5,5,37,??
Neerpriya Bakshi,"Rated Went to the recently opened Social @Odeon. This is located right above the Odeon Big cinemas. Don't get deceived by the 'lift' like entrance- they lead you to a staircase and then you enter a place that sends you back to your old school days. Yes, social here is themed on school. The staff wears green dps like school uniforms, furniture reminds you of the school desk and benches, there is a ruler and a pencil too at the tables and they even have a principal's room there. Apart from the ambiance, rest is the same as other socials. The only difference is that they have some new drinks added to the menu which are quite exciting- like old monk jal jeera and vodka aam panna. Apart from this there is a heavy 33% alcohol tax which has been added which adds a bulge to your bill. We ordered the fully loaded nachos and the tennesse wings. Damages were decent. Can visit for the old school charm with decent food.",Rated 3.0,43,227,??
Medha Sehtia,"Rated The seating could be a bit more comfortable. The preparation and cost are just Social being the Social brand. Didn't like the beet and pear salad too much but it was well prepared, just not my thing. The pancakes and scrambled egg breakfast was tummy wellness happiness. Their toasted bread is super sad. The chicken Bao is great comfort food. Tikka tacos are a little oiler than they should've been. Overall.",Rated 4.0,28,297,??
Vivek Saini,"Rated Refreshingly unique and surprisingly calming. Just like other social branches , the menu for both food and drinks is pretty standard , with similar taste and quality. Perhaps , what does distinguish this outlet from others is the striking ambience. I couldn't just get enough of it. From typewriter artifact on the table , to the huge bookshelf , to the square window pane wall on one side , everything about the ambience is spectacular. The staff is well trained and courteous. A southern fried chicken burger and a glass of red sangria fetched us a bill of rs. 800 approx ( all inclusive ). It's an experience worth having at least once. Looking forward to visiting again.",Rated 3.5,79,119,??
Gurinder Pal Singh,"Rated I got a chance to get a sneak peek of brand spanking new Odeon Social, Connaught Place. Social Offline is known for its out of the box approach and quirky twist to food. What caught our fancy were the interiors, which was influenced by Back To School theme. Step into the restaurant and everything from old typewriters to rotary dial telephone to wall full of trophies & book shelf, is reminiscent of school days! Tasted quite a few dishes and will share my favorites Awesamosa Super crisp samosa stuffed with cheese & mushrooms served with Sriraja Chunda & Green Chutney. Samosas were so crispy, airy & delicious, one of the favorite food items. Double Grilled Naga Chilli Cheese Toast When a dish has naga chili in it, you would expect it to be smoking hot , but thankfully it was crisp & moderately spicy. Chili Chicken Good old chili chicken with capsicum. Chicken was tender and juicy from the inside and crisp from outside. Butter Chicken Biryani We did find the name intriguing. The dish was a winner with buttery chicken layered in the bottom of the pan with fragrant rice & crispy onions on the top. In desserts Chocolate Blood Bath Most loved dessert !! Also in cocktails dont miss Longest Long Island Iced Tea, Game of Sling & Cosmo are highly recommended. Overall its a fun place to hangout with friends saadidilli.com",Rated 4.0,35,5335,??
Riddhi Sood,"Rated Ambience-5/5 Service-4/5 Food- 3/5 Pricing- 3/5 Ordered :Kori roti, Lucy burger with two frsh lime soda We went on early Friday evening and we requested to sit in balcony section but it was full so we didn't mind to sit inside, low lights, friendly staff nice music. Food was okay but as always cp and there high rate resturant and bar. Experience wasn't that bad but please reduce the pricing. Ps: Please add more non veg piece in the Kori roti dish.",Rated 3.0,7,4,??
Aniket Siddharth Khati,Rated Great school themed ambience...............Food was tasty..............service was great...........nice view from the balcony looking over from Odean Cinema,Rated 4.0,2,65,??
Rajinder Ram Grover,"Rated Another Social, another theme, another experience. The high school theme is perfect for us millennials. The toppers board, the trophies and the teachers table. They really thought this one through. It really fulfils your dream of drinking while you were in school! The menu remains the same. The food presentations changed according to the theme. Which is pretty interesting. The food is the usual. Definitely a one time visit place and have a couple of good drinks at your high school!",Rated 4.0,36,102,??
Foodielove,Rated Omg!One of the best restaurants I've ever been to is odeon. The ambience was amazing and it almost felt like I was in a cool boarding school. The food was excellent! They've got this quirky finger food and drinks. If you are a chocoholic then you have to try chocolate blood bath and ferrero milkshake! Basically an awesome place to have food and fun.,Rated 4.5,16,23,??
Aastha Parmar,"Rated I am a person who was craving to visit hauz khas social since long time..i was totally amazed when i got to know about this new outlet of social and so decided to visit it. The thing i would highly appreciate about the place is the service , it was like we ordered and the things were in front of us (5/5). In beverages we ordered for homemade lemonade and social shake...both were good with a refreshing taste. In food menu we ordered for pancakes and butter chicken biryaani...it was my first time for pancakes so i can not comment upon them but yes i liked it's taste , the best thing was the butter chicken biryaani , the chicken was sooooo delicious. The only thing which disappointed me was that the indoor sitting wasn't for small groups. Overall lovely experience. Cheers !!",Rated 4.0,0,0,Expert in Connaught Place
Bharat Singhal,"Rated ODEAN SOCIAL :D This place was in wishlist always and will be always. well I had awsome experience at odean social. Ambience : 5/5 as it took me back to school, the badge , headmaster & the library. plus the booze & the food, where is better school than this? :P the classy seating arrangements as classroom benches and some head boy/girl chairs and long bamboo stick in headmasters hands, water bottle, candy, and lots more i dont even remember , would love to visit again & again. Food : 4/5 , crispy aloo tikki, completely failed me , i was like delhi6 can be failed but odean social chalanged and won. typical serving in patta topped with tamaring chutney & curd. chilly paneer - best was crispy noodles on top, gave it crispiness and awsome delight in eating, i had it all. chilli cheese toast- nostalgic about lunch box , the delight, simplicity & delicious. though a bit dry as compared to but it was totally same as mom made for lunch those days cheese nuggets - poppers, like a cheese blast. with perfect tangy sauce. was on repeat mode. no better explanation for that. SHOTS 5/5: No better shooters to drool you. AAMPANNA, JALJEERA, RUM & KACHAAAM ,WATERMELON TOO. was again on repeat, then i took a cab :P electric liit 4/5: the large, tha tall & the shocking. LIIT was literally rocking. i could have one but there is no better around. superbly derived. there were non veg dishes too, which i couldn't click, as my non veggie friends were too hungry but there reactions told me, this place has it all for everyone. i would recommend it for sure. my take is 4.5/5. have a visit. you'll love the space.",Rated 4.5,26,92,??
Sumit Prakash,Rated The fusion of food and drinks...make social special..special ambience...like it so much.. Awsome music good staff behaviour and hospitality...,Rated 5.0,1,1,??
Vabss,Rated As the name suggest this is a youngest sister franchise of social (hauzkhas). But as expected this place has landed into same faith as its middle sister (def col). Both the places failed to match the standard of HKV Social. Area wise its the smallest out of three and ambience wise its stands last in a row. Food is same everywhere so nothing new here. With the brand name of 'social' this place has failed to maintain its own independent identity in market. If u have visited the Original one than there is no point coming here.,Rated 2.0,93,66,??
Rahul Singhal,"Rated Loved loved and loved their back to school theme. From big teacher desks, old dialer phones, quirky crockery, charts on the walls and medals and cups on the shelves The food was also good and prices were reasonable as compared to some other outlets in CP. Some of the cocktails were unique and I thoroughly enjoyed my time at social.",Rated 4.5,83,74,??
Srishti Balam,"Rated Loved the ambience! Service was good. Coming to the food, I tried mile high club sandwich and it was yummy. The quantity was apt for two people. The presentation too was correctly done. Ferrero rocher shake too was yummy and thick. Overall, this place is worth every bucks of yours. Will go back there soon again!",Rated 4.0,15,116,??
Rao Bhupender,Rated 1. Very loud music. You can't hear the voice of the person sitting in front of u. 2. Poor service; waiter took 20 min to bring the drinks and food came after 40 min. That was time taken just for a sandwich. 3. Nothing good vegetarian on menu. HUGE DISAPPOINTMENT,Rated 1.0,2,26,??
Tanveer,Rated Very nice.. Your special odeon shake is just amazing.. The ambience is very good.. Just one thng d size of the plates are very small.. Otherwisr its nyc ! Would love to visit again :),Rated 4.5,11,6,??
Saivy Chawla,"Rated Finally my first visit on thursday night. Everthing is perfect. New place, new ambience, new huge bar. Its a new place i am expecting huge crowd on that day but i think many people dont know about this place. I am sure that the story will be different after 2 months. Rest everything is super awesome, whole new back to school concept and value for money. Will be back soon for another try.",Rated 5.0,65,73,??
Rishi Mishra,"Rated Now one More Social is Heart of delhi (Connaught Place) Best place to be hangout in Delhi, Awesome theme Great food and service....Specially School Uniform anf Concept of Social...",Rated 5.0,2,2,??
