Username,Review,Rating,Total_reviews,Followers,Expert_level
Rahul Desai,"Rated Finally went to this place, had heard so much about it. I won't even get to how the place was or what the food was like, just want to share the pathetic experience I had at this bar. I was on a date on a not so busy Wednesday afternoon. We both were in mood for some good food and I had heard reviews about this place hence we landed here. I'm sure for all those who've been on dates, you know how they work. You do not enter-hog-leave. You order a drink or two, along with some entrees, then the main course followed by a dessert. We had just got to the main course, when this waiter walks up to me in all decency, bends and whispers in my ear what would the most ridiculous thing I've heard since I stepped foot on this planet ""sir, jaldi karlo, aur bhi log wait kar rahe hai yahaan"". yes. those were the exact words. Now i'm glad that my date didn't hear this, and i'm sad that I was on a date and couldn't say anything in return or call for the manager, I just politely asked for my check, paid and left without us getting to the dessert. I have been to the busiest of the restuarants, not just in India but elsewhere too. But this just might be the worst hospitality experince i've had till now. It was insulting, blunt, rude.,...and the list can go on. Now i'm sure some of you might thing i'm overreacting, but trust me, if you step into my shoe and think if this happened with you, would you feel like punching the waiter in the face once or twice? Even waiters at Haldiram's wouldn't dare to talk like this. Warehouse, as the name is, has hired labor instead of waiters it seems.",Rated 1.0,10,3,??
Ashvita Mandal,Rated They have a different ambience.. Dark..underground steam plant ambience. Food is really nice .. Little overpriced though..Nice selection of music . But found little overcrowded even during weekdays.. Service is quick. Good place to catch up with frnds.,Rated 4.0,12,90,??
Manisha Shokeen,"Rated Warehouse cafe.. A gud place to let go and enjoy yoself!! Nice ambience, good music and quick service too.. Although a lil overpriced but a great place to hang out with friends and njoy da booze..the hookahs r amazing too!!",Rated 4.0,7,4,??
N,"Rated Not impressed with dark ambiance inside. Cut my hand against stair railings. Terrace is ok, chairs a tad uncomfortable. Oh well. Weren't served any of the non-veg items we ordered. Veg items were ok. Left eventually to eat and drink more elsewhere.",Rated 2.0,9,51,??
J W,"Rated If you love getting lost under the influence of high music with booze in one hand and friends on the other - This is the place for you. Awesome live bar, the big screen, great quality of food and the music so great you forget you're connected to anything else. The place is enigmatic.",Rated 4.5,58,178,??
Tanveer Singh,"Rated Ahhh..what a place..I have been here twice and both the time this place was successful in wooing me. Referring to the sitting at terrace, its pretty awesome. It gives you a complete view of central park and the traffic at inner ring road..we were sitting there in the evening and quite a view at sunset.. The seating inside on 1st floor is equally gr8...lighting gives you a happy feel and so do the music.. The prices are inline with the place and food..it taste good..the quantity is pretty decent.. You would see a lot of teen group and even families here..hookah smoke is all over the place..avoid the inner seating even you are allergic to that! we ordered fires, drums of heaven and panner tikka..and nothing was disappointing. And at such place, one seldom expects Indian main course items to be good...but the chef proved us wrong! Even the items like Kadhai Paneer and Chicken curry tasted gr8...",Rated 4.0,19,36,??
Jatin Gulati,"Rated The main seating arena is a bit gloomy and Food is also a bit overpriced, other than that everything is Great!. Sofa Seats, Good Food, Spacious. Perfect to spend a boozy evening with Friends, just make sure your Pockets are Full ;)",Rated 3.5,5,78,??
Sandhya Handa,"Rated THE WAREHOUSE CAFE 1ST JANUARY 2014 A lounge cum restaurant cum cafe...u know and you name it..Amidst the hustle bustle of the busy connaught place, this place situated on a first floor in D BLOCK gives u what you can ask for...a lounge feel with the classy interiors and the music soothing on ""that accurate mood."" A serene feel with that roof top seating ...taking a sip of that hot and alluring cuppa coffee and having a view of the whole of CP on that one go...a place so so perfect for group of friends or couples or a single company...it charges you throughout.. Speaking of food... Adams apple was a mix of cucumbers and mint and sparkling water..a thumbs up and a refresher in this cold chilly winter. Chilly paneer was a hit hit amongst all the ordered items. Warehouse spl pizza was an average scorer due to its clumsy base and lack of sauces.. Penne white sauce pasta was a saviour but still lacked that WOW WOW FACTOR... All in all its a remarkable place for the chit chat sessions , or formal meetings or clubbing... worth a repeater and recommendation folks.",Rated 4.5,7,83,??
Manav,Rated Its again out of words U know delhi is full of eathities I m a true fan of it,Rated 5.0,2,0,??
Gurmeet Singh Kalsi,Rated Good location. Good staff. Good ambience. Specially the lift which takes u directly to the pub. Open terrace is there. I like that.,Rated 4.0,71,35,??
Abbas Qasim,"Rated Good food, a bit expensive though. The service was also slightly slow. ----- 31 Dec, 2013 ----- Great food ! The service is a little slow though..",Rated 3.0,3,50,??
Nimisha Arora,"Rated Its a nice hang out place, ambience is good even food and service is also good. I visited this place with bunch of my friends. A place with an excellent food, ambience and service.. What else will you ask for. Must visit this place.",Rated 3.5,32,198,??
Bhavna Negi,"Rated This is one place for every celebration. You'd love the decor and style of the restaurant. We always had someone attending - walking around, cleaning tables, visiting us and offering to take orders to the tables etc. This made for the best service at any restaurant we have ever had! Everyone wanted to taste everything on the menu. We order Penne Arabiata, Cheese French Fries, Spring Rolls and Chicken Rolls. The food was fresh and delicious. Served hot and perfect in taste. The drinks were heavenly. We never stopped ordering Chocolate and Hazelnut Shake. [A must recommended]. We also loved the GreenApple drink, Cucumber basil lemonade. The get together at Warehouse cafe, was more than amazing. I look forward to celebrate more happy moments with Warehouse. Thank you for being an amazing place !!",Rated 4.5,1,1,??
Jagjyot Kaur,Rated Chicken lasagne was good. They had happy hours as well and service was decent and quick.,Rated 3.0,23,246,??
Shashank Jha,"Rated For those with a fat wallet, this is the place to be.. Great crowd, lots of options in drinks and sheesha..haven't really had anything to eat in my two visits (i do not have a fat wallet, so...) so can't talk much about the food.. The service is good, considering the place is huge, they've had to.hire an army of waiters... All in all, if you have the money, warehouse cafe beats all.",Rated 3.5,24,144,??
DC,Rated Warehouse cafe feels like the place next door. It caught more eye when I saw groups of people standing outside the elevator almost ever time I crossed the reception. First floor is definitely a thumbs up for the ambience and decor. Since I visited the place on a Saturday so couldn't find a table and had to move upstairs to the roof. Roof has a decent CP view but the seats on the wall side are a Big NO. Couches are great to sit and chat though the Place gets crowded very easily due to less space. Food and drinks were good. Overall a place you can visit for sure only if you haven't got any other awesome place to hang out. Cheers.,Rated 3.5,40,332,??
Ashish Sharma,Rated I so wished that I'd be writing a good review but the place isn't worth the 'supposed' buzz. So here it goes : they only 'apparently' are responsive if you are in a group..any head count less than two..& you'll curse yourself. Service is pathetic. The guy would leave you with 2+1 or 3+2 bottles/pegs on your table & disappear without bothering to check if you'd also like to eat/order something else. Want him back ?? Get up & find out. Cancelled an order today ( courtesy reason mentioned) & nobody bothers to ask WHY. Confronted the Manager who initially rude then apologetic ( obviously). Enter at your own risk !! Also kindly keep cash or use your credit card since they don't have a wireless swipe machine too ;-),Rated 1.5,82,628,??
Ajeta Shinde,"Rated I would say Good enough! I had not been to Warehouse Cafe till today though I was in CP was November for work. A week back while returning from Barakhamba Raod and craving for a good hot Arabiata Pasta, I stopped at Warehouse Cafe. Both me and my partner were visiting it for the first time. I am not to fond of the lounge culture a lot (as I said in my last review too) but I kind of liked the place. The food was good. I mean the Pasta was really nice. Loved it. Infact I loved the service more. I had some issues with their garlic bread which they told me were like how they were served. But I told them that I did not like the garlic breads and they instantly changed and got me garlic breads how I explained to them. A very short visit but a great experience I would say. Only one thing, we would have a 10-20% percent discount had we come via Dineout but nothing if we were a regular walkin. Next time, I shall keel in mind. I will surely go again",Rated 4.0,7,23,??
Nitai Utkarsh,"Rated As of the moment, Warehouse Cafe happens to be the most popular eatery in Delhi NCR as per Zomato with more than 350 odd reviews and some 1200 votes. Considering that the impact of Zomato and similar social media on the choice of what and where you eat, drink, or shop, it was not surprising when we zeroed down on the cafe for our office lunch outing. So it was that the five of us landed at the rather strange entry of the cafe (it is an elevator, no other way of entering the cafe except perhaps a service entry at the backside which was not visible). As we entered the ""cafe"", the first thought that crossed our minds was that the interiors of the place belied its tag. Rather dark (bordering on dingy for the time of the day), the place seemed perfect for a fun evening out with friends for a few drinks but could have been slightly brighter during the day to qualify as a cafe. Since we were decided on an outdoor seating, this did not impact us much as we moved on to the terrace which was oh-so-refreshing for a wintry yet sunny afternoon. We were extremely impressed with the rather large open air seating, bang in the middle of Connaught Place with a nice view of the Central Park and the inner circle. We had read bad things about the customer service in numerous reviews and it was just as reported and expected. There does not seem to be any attention paid to make the guests comfortable and if you need staff's attention, you need to really earn it. Expecting this as we were, we placed our order with the alacrity and loudness required at such places and that seemed to work for the order was taken down quite in one piece. We made do with pita bread with hummus, mozzarella fingers (cheesy fried potato poppers), Greek Salad, half-n-half Pizza, one half with mushroom toppings and the other with mixed vegetables, Grilled Fish with mashed potato on the side, Cottage Cheese Panini, and a fish based salad. To drink, we ordered a couple of Virgin Mojitos and some fresh lime soda/water based drinks. The drinks menu looked quite exhaustive but that would have to do with a subsequent visit, we thought. The pita was quite soft and the hummus had its flavor just right. Mozzarella fingers were quite the stars with the cheese filling pretty generous and the entire thing fried to just the right extent. The Greek salad was disappointing with feta cheese chunks thrown in with the other veggies and the whole thing lacking any sort of consistency. The pizza was rather bland with nothing that stood out, neither the cheese nor the toppings, and not even the thin crust. The panini and the fish salad were adequate but what really stole the show was the grilled fish dish. Wiped off the plate, this was one of the most satisfying variant of the dish that we had had over a long time. The drinks were nice and special mention is mandated of the Virgin Mojito, which seemed very balanced with the mint, sugar crystals, and the ice all mixed in correct proportions. The ambiance of the open air seating was quite nice as I had mentioned earlier. The cane furniture and comfortably tall tables made for some nice time spent soaking the winter afternoon sun. If there was anything that really got one's goat, it was the service. The delay in someone...anyone attending to us, to getting us the wrong order, once too often, and finally just the basic disinterested attitude of the staff left a sour taste in the mouth despite the decent food and the good ambiance.",Rated 3.5,29,128,??
DAPHNIE,Rated The food is very tasty but the service is slow and snooty. The crowd is posh type and it costs a lot so be ware and carry cash because the card machines don't work.,Rated 3.5,6,78,??
Naman,"Rated This is one of those places where they treat you as peasants at a Food Shelter. The Saturday Night frenzy is understandable but inconsiderate behavior is not. The Servers were simply not interested in the customers, half of the drinks were unavailable, he was not open to discussions regarding the best combinations. There was no 'happy-to-serve' attitude: a pillar of the Service Industry. The Food and Snacks were fine, and served in decent time. I really liked the Shawarma Roll: it was very nicely done. The seating was kind of a letdown. The group seats outside are too low to enjoy the open view and the side seating is too high and cramped for comfort. Maybe the Inside seating is better, where the Manager is on Patrol. The interiors have a great decor, and the extended portions offer various seating styled options. Overall, I'd say there are plenty more better options in the vicinity to check out, rather than disappoint yourself here.",Rated 2.5,17,26,??
Navish Dogra,"Rated Off late CP has lost its 'hang out'. And unfortunately, hanging out at warehouse cafe 'wore' us inside out. To start with, the service was a dampener. I think mentioning self service on their menu would have served them far better than a bunch of waiters strolling up and down and caring to take orders only when they were tired of strolling. Beware that they will spend a pre decided amount f time on the table and you need to ensure that the guy notes down the order well before they vanish . As expected, to err is human and in a place like warehouse , to err is norm, they got us an entirely different dish ( our initial choices were not available ) and said that it can't be changed now. We ordered one veg dish also and voila it was the disaster of the evening - hara kebab. In the end the card swipe machine was not working which is a first for any place in CP that I have visited so far. Most of the others were also complaining about the shoddy service and bad quality of food/ hukkka. Ambience - 3 Food - 3 Service - 1 ( as we switched to self service mode ) There are far better places that give you a much better experience in NCR. Off the list.",Rated 1.5,4,48,??
Neha Mishra,"Rated The quality of the service and the staff is a very important aspect of all sectors in the service industry, it becomes all the more important to me at restaurants Im paying anything more than Rs. 1000 for something that doesn't fill my stomach or satiate my craving. This is because at such restaurants we pay for the experience and not for the food. Warehouse cafe falls in the category of one of these restaurants. It had caught my fancy ever since it is much hyped per launch party and a group of people waiting outside the lift every time I passed the lanes on inner circle. So it was finally on a Saturday evening we decided to give it a shot. As we reached the first floor and stepped outside the lift, we were completely transported to a totally different world. Kudos to the brilliant d&cor and the amazing furniture. The first thing you see as you step out is a long beer counter and you know that you are in for a great time. Well, atleast this is what I had thought in the beginning. Continuing the point from the first paragraph, just when I was done admiring the place I had expected that there would be someone who could help us with the tables as they were extremely crowded at that time and they had already declined our request of pre-booking (which is totally acceptable). Well there indeed was a guy from the management whom we approached to help us find a table to which he politely told us to go to the top floor since as per him the first floor was completely packed while the open area was still vacant. We did go upstairs but that place was all the more crowded and the staff there was equally clueless about any vacant space and asked us to try the indoor seating. We went downstairs again and asked the same person to help us with a table. He smiled at us and assured us that he would be of help and we as polite people waited for him to help us. But then within minutes I saw atleast three different groups of people just stroll in and grab a table without any one from the management even caring about it. I was really put off by this, however on persuasion of my friend I decided to stay on and speak to the staff about it. On asking them about their way of allotting table to their guest they did not have an answer but they did arrange a seating for us within minutes. I thought this was the end of the ordeal but I was wrong. The table given to us was just outside the kitchen and I literally had to save my head to avoid collision with the plates full of food every time a server passed by. On politely asking to shift out table we were outrightly declined saying that the place was full. Considering we were just the two of us, finding a table should not have been so tough. Nevermind. By then I was really in no mood of ordering anything however just for the sake of it I decided to go for the Nutella Peanut Butter Shake of which I had heard good reviews- it was again not available. Another put off.!! Finally we ordered a Chocolate and Hazelnut Shake, Homemade ginger Ale and Hawaian Chicken Salad. The drinks were average but after a few bites I realized there was no chicken in my salad which on asking them was replaced. But all this put together had totally spoilt the mood and we were in no mood of trying anything else. Points given only for the the brilliant decor and the decent food. Warehouse Cafe is surely not going to be on my list for a very long time to come.",Rated 2.0,127,1075,??
Sanvit Singh,"Rated It is a lovely place to hang out with friends, entry may look a bit small but the cafe is huge..ample place to sit, music is gud, and the best part is the food..We tried there Sarson Mahi Tikka which was a tandoori fish made of Sole fish..and it was superb..Penne Alfredo was descent but there Herbal shesha was not so satisfying..service is a bit slow but overall ambience is too good..Overall a good hangout place..Cheers",Rated 4.0,72,346,??
Tp .,"Rated warehouse - at first i thought its a godown for some electronics store - hahaha' till the time i entered . nice place with nice ambiance. drinks specially mocktails were not that great but food was good to taste , music was something wich i found it hard to connect . service was good as it took hardly snytime to get our orders . they are situated in best location of delhi can do wonders . a little bit of hard work is required else all was good .",Rated 3.5,6,4,??
Pamela Roy,"Rated Simply happening ,great place for fun,masti,booziinnggg...music was great..more than the terrace lounge - one will enjoy sitting inside...the ambience is all fun in the air..we enjoyed a lot...",Rated 4.0,17,14,??
Ravinder Kaur,Rated A nic place 2 visit....nic ambience.. deephouse music.....food ws good.... Rooftop is a plce 2 be...servic is a lill bit issue...!!! Overall a good place to visit,Rated 3.0,8,8,??
Chanda19,"Rated We were a group of 10, and invited for lunch at the warehouse in CP. Was easy to locate, welcomed by th lady at th elevator. But the moment you enter, the restaurant is extremely low-lit. Coming inside from a beautiful winter afternoon outside is a bit of a shock. We ordered a lot of food, and it was all good,esp the Caesars salad. Some portions could be bigger though. Cannot comment onthe drinks, as i had a beer. Service was good too. No trouble there. I'd rather go for a dinner the next time, as the ambience is not for me. Great for the young hookah loving lot. Gets filled up by 3pm on a sat afternoon, and was packed when we left at 4:30. A bit of daytime claustrophobia for me. But good food and service. Cheers!",Rated 3.0,83,163,??
Sparsh Oberoi,"Rated Finally got a chance to visit the Warehouse Cafe. It was an office party & we wanted to sit in the open. The terrace seating did not disappoint & I think that is the best part of this place. It is expensive no doubt but mind you, it is the heart of the city. Coming to the menu, it is a calendar & the dishes have been displayed date wise with different cuisines constituting each month. Interesting concept but the novelty lasts only till the first visit. Since we did not have a lot of people drinking that day we focused on the food. The biggest surprise of the day was that they were unable to serve us pizzas. The waiter said that they had run out of pizza base which is very weird for a restaurant like WC. Anyways, we ordered a lot of snacks starting from Nachos, honey chili potatoes, hariyali kebab & sandwiches. There is nothing extraordinary about the taste or the quantity of the food. It was an average affair. The service is damn slow. We were there by 4 PM & each of our order took 20-25 minutes to reach us. Even the drinks were served to us with a 10 minute delay. Here also the variety of beer available was pretty limited though the menu has a long list. It was a good time spent due to the ambiance & the view that you get of the central park. Besides the location of the restaurant, I do not think anything else stood out which can be really written about. It's a decent place but overpriced & overrated for sure.",Rated 3.0,34,253,??
Aakash Mukherjee,Rated I visited the place few weeks back for the first time and I must say I was pretty impressed with both the interiors and the service. The ambience is very good and very fairly priced.,Rated 3.5,6,57,??
Sahil Lamba,"Rated Good place , nice ambience but they didnt have many drinks avaiable that ever on the menu . Great pasta but worst chicken wings ever.",Rated 3.5,8,103,??
Tirupati Rao S,"Rated Warehouse........ It's really a warehouse of fun, laughter and Booze.... Man.. The moment you enter the restaurant.... Damn.. It's too huge.. Floor by floor.. Seat by seat... Bloody Awesome.. Ambiance.. One of it's own Kind.. and the best in Cannaught Place.. :) Fun unlimited.. Only and only if you have money unlimited... Ravishingly spent area with lavishingly maintained.. Most pinned thing is menu.. "" It's just a calendar.. the day you are in.. the type dish will be served according to day... order it and get 50% off.. "" For me one of the best ever seen in Cannaught place...:) Pros : 1. Ambience rocks. - Awesometastic ambience and a wonderful view from terrace chairs. 2. Music - Number played are usual ones.. Not much captive.. and makes you to talk with buddies instead on enjoying music. 3. Ample Space - They have huge huge huge space, spent any amount of time.. 4. Waiters or servers are having sound knowledge of english.. No struggle for Outsiders.. Can manage easily. Cons : 1. Food - The amount we spent on food is not worthy we get.. can say food is average. 2. Expensive - this place is huge expensive.. if you have pocket full of money to be spent careless..""please do visit here"" All in the one.. "" one time visit.. and it will be up most memorable."" .",Rated 3.5,38,74,??
Somya Shringi,"Rated While walking on the inner circle, CP you have numerous options. My visit to this place was totally experimental - in search of something new.And trust me i was really surprised with the nice ambience, long bar (coz i really love having drinks with my friends on bar) and the theme they have deployed here. I went on a sat evening around 8 and the place was jam packed. There menu card is really innovative and you just fell in love with the options. Staff is slightly untrained but very polite & helpful. There is lots of sitting options and going to this place makes a much more sense if you go in a large group as their pricing strategy is to give benefit on bulk deals. Overall, a fun place - recommended.",Rated 4.0,40,45,??
Vinayak Kumar,"Rated Its a big big lounge. My wife and I went there for dinner and we were very very impressed by the ambiance. Its in the middle of my favourite market, C. P. and the entrance is through a small lift which opens up into this humongous monster of a place. Themed as a Warehouse, its brilliantly decked up and worth a trip just for the experience. We loved the menu, with each category (page) representing a month Coming to the food, we had a Half&Half Pizza (Chicken & Veg out of 20 odd choices!!) which was good. Disappointed that the cocktails were not up to the mark. And the place does pinch the pocket. As a result, ticked off 1 mark.. Tip: Worth it just for the experience",Rated 4.0,0,0,Expert in Connaught Place
