Username,Review,Rating,Total_reviews,Followers,Expert_level
Mehul Parwani,Rated Had a bad experience with warehouse cafe! In 1.5 hrs they were just able to serve us with a pitcher of beer and a mocktail.. The waiter seemed uninterested and were just whiling away their time by roaming here and there. It took them half n hour to just take our order and 25 mins to just serve plain water!!! Pathetic customer service with no reason. The cafe was running not more than 30% occupancy and now I realize the reason behind such a low foot fall.,Rated 2.5,28,95,??
Sameer Shridhar,"Rated A very nice dark shade and absolutely sexy ambience for couples as well.. Shady Place for you hunger to have with a loud music! Variety of food, and tastes very nice! A must try place, in the centre of Delhi.",Rated 5.0,36,82,??
Akshay Dhoot,"Rated the service is so bad...the waiters are all trainees and keep getting you orders of tables close by, and mixing up your own orders. the seating is also not very comfortable. food is ok....but the sheesha / hookah is horrible....on the whole a very bad experience and way too expensive for the disgusting service.",Rated 1.0,5,0,??
Nikita Jain,"Rated Much i liked warehouse in first visit.... More i loved in second visit. Dey hv beautiful orangish ambience wid whole pipe fitting ceiling look. On entering to cafe from elevator... You'll see bar wall. For cricket fan dey hv full arrangement of big screen. My yummy order ws achari paneer tikka, malai soya seekh nd masala peanut... High authentic masaledaar north indian chat patta flavor. Very balanced taste. For a change i tried cold coffee nd not cocktail?. Cold coffee ws yum. Dey serve sheesha too nd in very good flavors.",Rated 4.0,57,136,??
Ankit Kankane,"Rated Great place amazing ambience. This place gives a feeling of a high class pub. Dim lights and unfinished look of the ceiling definitely adds to the ambience. I liked their spread of beer specially because they had many available. Although I am still a little disappointed that they didn't have Stella and Hoggaden despite them being in the menu. I would have given 4.5 but I didn't like any of the food items. I ordered nachos, jalepano rolls and crispy chicken. The chicken was hard from inside and rolls cold. It was fine for munching with drinks but I would expect some improvement in this front. Cheers Ankit",Rated 3.5,40,62,??
Sumit Vyas,"Rated One of the best places to hang with friends over the weekend. Though, it is slightly expensive, but worth it. The ambience is pretty good. In menu, the warehouse pizza is must along with pasta. In drinks, liit is a necessity to have. I have been to this place for around 3times and always came back satisfied.",Rated 4.0,33,82,??
Pallavi Kaushik,"Rated The only redeeming characteristic of this place is it's amazing and beautiful ambience. Especially the bar area is spell bounding. However when it comes to food, this place is a major let down. On my first visit order i ordered veg club sandwich which I'll never forget. I seemed that they have stuffed normal grocery store bread with cucumber and mayonnaise. That's it. Nothing else. And the exorbitant price for this!! Will never visit this place again.",Rated 1.5,40,50,??
Prutha Girme,"Rated The last time I visited Warehouse Cafe in CP I paid my bill through debit card, their staff swiped my card twice. My account has been debited with the amount twice and they refused to take ownership of their mistake. The manager Mr.Vikas gave me a handwritten note that if the said amount does not reverse to my account within a week, he would remit me with the extra amount they have charged me with. I have Mr. Vikas's visiting card and I have been trying to get in touch with him since the past one month. He has been declining my calls ever since. This incident took place on April 17th. I am a regular at Warehouse and I like the food and drinks served there, but ever since the incident I haven't visited again. It is not about the money, but the level professionalism which is expected to be displayed by your management team. I do not know how do I bring attention to this issue by higher authorities at Warehouse cafe.",Rated 1.0,1,34,??
Namrata Singh,"Rated I wanted to visit this place from long time, so on this lovely rainy evening we thought of paying a visit to this open terrace cafe. The roop top area was very cluttered with discomforting chairs and tables, which were pretty small to accomodate their calendar menu, tissue holder etc. We went down stairs which was very nice and spacious. Ambiance 3/5. Coming to food and service. Service - Good, 4/5 (one deducted for not service water), Food- 3/5 - starters I tried were Mushroom kurkure (not good, dominating taste of capsicum), Warehouse Murg tikka (slrrpp..yummy), Chicken with BBQ sauce (sweet, not my preference bt different taste). I found place bit overpriced compared to ones similar to them. Overall decent place.",Rated 3.0,63,126,??
Siddbatta,Rated Huge place !! Nice place to hangout with friends. Endless options for food and it taste good. Service 3/5 Food 4/5 Ambience 4/5 Crowd 5/5 Staff 3/5,Rated 3.5,9,2,??
Gurinder S Cheema,"Rated Saturday night when our hope ended for My Bar, someone suggested me Warehouse CAFE. Located at first floor and a lift to carry you up and down starts the fun. Place is spacious. Full length bar with enough settings for solo flyers. Dim lights with live dj were helping to escape the city madness. Seating is with bar chair tables in the center and reserved sofa sections around the corners of place. Walkins gonna get tables only. With company of 4 we ordered drinks. We gave the order for drinks, food and hookah. Things came up on time. Chicken and mutton starters were delicious. Service was excellent. That night we got a instrument music performer who played diff instruments on dj songs. It was dope environment. Crowd was awesome. Place is little bit expensive when it comes to pricing. Still money was well spent. For gang outing this place is best for weekends!",Rated 4.0,11,28,??
Prekshi Arora,"Rated I visited the place last year and was quite impressed by its ambience and decor. To start off with food, it's dahi k kebabs are palatable. The portions are a bit less. We had also ordered hookah and the flavor was exactly what we had ordered, unlike many other restros and bars, where flavor swapping happens without the customer's consent with a silly logic of either the unavailability of the ordered flavor, or an usher's mistake or a simple issue of strong or weak flavor.",Rated 3.5,44,74,??
Anand Sharma,"Rated I have been to this place twice on my Delhi visits..it's a nice place to chill out with friends and couples though the music is very loud all the time so not a good place to talk much..the service is very nice and location, I guess I don't need to say anything about that..but I have one suggestion that they should also build a smoking zone on the 1st floor guest like me who needs to smoke need to go on the roof top each time they want to smoke..otherwise it a nice place to visit and have fun..even the food is good though nothing great about it.",Rated 3.5,37,109,??
Prateek Giria,"Rated Awesome ambiance, located in CP, it is very much accessible from anywhere in Delhi. They have one offer a day on food, one item, they offer at half price.",Rated 4.0,9,252,??
Priya Amuthalan,Rated Nice ambience Crappy pasta (chicken alferado) - not even al dente and looked more like scrambled eggs Crispy chicken in bbq sauce.. Trust me even My Bar has better food. The beer wasnt chilled at all. You guys have a reputation n ur losing it.. Ensure that you fix these things before it gets worse.,Rated 1.5,14,8,??
Ankit Chaudhary,"Rated Its one of the fantabulous place in cp to hangout wid frns also the dishes served are very tasty be it anything u order, it has got very nice ambience and service is quiet good!!",Rated 4.5,8,53,??
Akashdeep Singh (Travellersfoodboxx),"Rated The best thing about this place is that its huge and you dont feel claustrophobic. The interiors are done perfectly with dim lighting. The presentation of their menu is unique, its a calendar turned menu. The food quality and quantity both are apt according to the price. The service needs to be looked at, its very slow. Overall a nice place to hang out.",Rated 4.0,0,0,Expert in Connaught Place
Harsha Gautam,Rated An amazing place to go crazy with friends. Loud music and the aura filled with the smell of Hookah! Perfect place to enjoy a cricket match at the big TV screens. In awe of the Cafe.,Rated 4.0,57,125,??
Vijay Ashwani,"Rated I have been over here wid my friend, it's Ambience is very nice!! Food is average quality,, Music is also ok,, but you enjoy the place!! Must go once!",Rated 3.5,2,27,??
Veenit Varma,"Rated One of the better joints/cafe's in CP. My first time there was last week ,May 15 with a old college friend. the place looks small from outside but its huge inside. A contemporary lounge...i loved the crowd and ambiance of the place. The chicken lollipop was brilliant but the nachos can improve. I will back here very soon.",Rated 4.0,19,117,??
Kunal Shaw,"Rated I have been here couple of times and undoubtedly this place considerably has done well with the food it serves. The only bone of contention for me to be a frequent visitor to warehouse has been its pricing over its food. I personally feel, the prices are mismanaged to quite an extent. For instance, a palate of French fries with cheese nowhere deserves to be priced around 300. Although the quantity and quality is not compromised. The ambience befits it's very name ""cafe"". A good choice of both indoor and outdoor rooftop sitting.",Rated 3.5,15,46,??
Manish Saini,Rated Menu like a calendar...discounted dish of the day....food is really very tasty...nice people ...nice staff...open terrace.....nice place....,Rated 4.0,193,5726,??
Aviral Bajpai,"Rated Placed in the inner circle of CP, as you walk to the entrance, you'd picture a small congested restaurant with crowd tossing you around. Enter the elevator and hit the 1st floor button and you'll know that it literally is as big as a warehouse. The place is simply amazing! The ambience they've created and the size of that place would surely make you laugh of what you were expecting out of that place. Right when you enter the place, there's this huge bar that you see adorned with drinks. And as for the brand, you name it! They'll have it. We sat in the lounge and it was modern. Now the reason I say modern is because nobody likes to shout in such a crowded place to call for a waiter. What they have for you is a remote buzzer on each table with multiple options to call the waiter for your table to trigger different things you'd like to get assistance for. Like water, bill, order etc. When it comes to the food, the pizza punjab da, the chilli chicken, mix veg fried rice and nachos were a few things we ordered along with a Pan Hukkah. The nachos were disappointing as the cheese froze as we ate them and the seasoned coriander messed up with the taste. As for everything else, it was pretty good. The pizza is a must try. Crispy crust with Indian masalas coming from Punjab as the name clearly shows. The sheesha was pretty good too with the coal providing good and dense smoke for long. The music might seem loud and it wouldn't be the best idea to take a phone call there but it goes well with the mood. The service was pretty good and the remote buzzers concept is an idea executed to perfection. All in all, if you're anywhere around CP and you're hungry, Warehouse Cafe is the place to be.",Rated 3.5,8,19,??
Sanyog Chaudhry,"Rated Rooftop, loud lounge music, awesome view and lost support staff (servers) are a few things that stick to your mind when you visit the Warehouse. The food is nice and filling, though ordering through a myriad of prongs might not be everyone's cup of tea. Service is greenbelt quick that is if you can grab the attention of the serving staff. Priced as per the location so go with your monies in the bank.",Rated 3.5,26,75,??
Dipakshi Pupreja,Rated Visited dis place few days bak with frnds nice place with good music n food too Menu is quite interesting n vast... best is dere indian food...,Rated 4.0,22,93,??
Shivangni,Rated Located in centre of CP.. Not so difficult to find ..I just went to meet my friends over there .. I liked it's ambience and service is fast thankgod .. Food n all is good..,Rated 3.5,8,4,??
Sahil Sawhney,"Rated Amazing restaurant in the inner circle of cp. From outside it looks a very small cafe type but from inside its huge. +1 for the terrace wing. The food is simply irresistible. Perfect menu for a foodie, loved the drinks as well",Rated 5.0,24,304,??
Ritika Jain,"Rated Peppy music and good food in the heart of Delhi! Really love their menu designed as a calendar. If you're lucky to dine on a particular date, your dish will be on a 50% discount!",Rated 4.0,12,73,??
Nomi Sharma,Rated Great food.......nice Ambiance.......one of the best rooftop restro bars in CP......if you are willing to spend 1500 to 2000 per person for food and alcohol then this place is worth spending the night ;),Rated 4.0,3,32,??
Erick Massey,"Rated The terrace sitting is awesome provided that you get a seat there, The menu is served according to the days and the ambience is great. A good place overall.",Rated 4.5,68,98,??
Suniti,"Rated It is a nice place to be in, the food was good ans scrumptious. The ambience was good and the MUSIC was really cool. The price is also competent if considering the place, enjoyed being their",Rated 4.0,40,29,??
Somil Malhotra,Rated Amazing place !! Had a good time. The music was a little loud though...but it was ok. Food was great. Had ordered pasta and crispy chicken with mayo and it was great. The only thing was that thr sheesha didn't have a taste at all. We ordered paan + apple and although it seemed to be prepared well but didnt have a strong taste. Overall it was a good experience.,Rated 5.0,13,1,??
Shweta,"Rated This place has totally won my heart.Dude this is more than awesome.Out of all the restaurants that i have tried (including those also which i have not reviewed on zomato) warehouse cafe surely has made it to my top list.I went in there with my boyfriend for a lunch date and it turned out to be so pretty amazing, all thanks to the warehouse cafe. The food is super delicious, the service is also good , music is woww and 1 more advantage is the hukka.Actually the hukkas are quite rare in delhi and gurgaon, so whichever place serves hukka that becomes the best for me as i am a hukka lover but hukka is overpriced and that is the only thing which i can complain for otherwise this place is a total thumbs up from my side. I would love to visit this place again and again.Highly recommended CHEERS !!!!!",Rated 5.0,16,96,??
Vaibhav Rajiv Chakravarti,Rated A big hit. Amazing place to drink enjoy in open . Live coverage of sports . Sheesha nice. Ambiance soothing. Quality service . Menu is interesting.,Rated 4.5,39,59,??
Himanshu Garg,"Rated This place is like a pearl in the sea means I first visited this place last year since then even I don't know how many times I have been there. Ambience too cool , crowd awesome , food is just amazing tough I'm non drinker but they got a vast menu to choose your drink. What make this place a happening place is crowd means full of energy. This is the best place till date I have visited in CP.",Rated 4.0,14,39,??
Tarushi Choudhary,Rated So far the best lounge in cp.. Great music n atmosphere. A little expensive on pocket but worth going. Went there with my family the crowd was chic. Had a great time .,Rated 4.0,33,79,??
Gokul Chowdhary,"Rated After a long day around CP, this place hit the spot. Nice outdoor deck. Good food and drink. One can only access this restaurant by a private elevator. The music is quite loud. It seems the volume switch is broken in the restaurant, way to loud. The rooftop is the better option. The interiors are dark but hey! it bloody works cause guess what privacy is something everyone wants. It looks more like a bar than a restaurant. The servers were very patient with our orders and attentive. It claimed to have 365 different dishes based on calendar days and the menu is also in calendar form.",Rated 4.0,0,0,Expert in Connaught Place
Prateek Nangia,Rated We went dere on Saturday evening without table booking N we had to wait for 10-15 minutes for table..which was acceptable.. D ambience was nice..Bt d music was so very loud so talking is little difficult... Food was not so nice I ordered pasta N it was not cooked properly n not worthy at all..service was okok...dere r better options available in cp...,Rated 3.0,66,62,??
Arun Deswal,Rated The interiors are just like a warehouse and this place is very big from inside. Most of the crowd is from business class. First class seating arrangements and spacing. Expensive booze and food. I ordered pasta and it was good.,Rated 3.5,9,55,??
Pragya Duggar,"Rated All the rating is to the roof top ambiance, however, we couldn't use it to because of the weather.Anyway going forward. We were 6 people, ordered some dishes like pasta, Tandoori Platter and one non veg dish. The pasta was pathetic, half cooked. We asked for replacement, even then it was equally bad. The platter was yukk too.My friend said the non veg was good, i don't know I am a vegetarian.Adding to the blunder is the so non-cooperative staff. Totally annoyed.Bad choice.Learn to serve better and be good to your customer.",Rated 2.0,3,0,??
Lakshay Dulani,"Rated The best thing about this cafe is its location and ambience. Ordered drinks, pasta and salad. Taste was fine, not great. Went there on an evening which had a lovely weather, so made the most of its roof top. Looking fwd to visit this place again.",Rated 4.5,26,35,??
Dhruv Dhall,"Rated The food is just about average.Service is slow I would say.The ambience is quite nice.Sitting outdoors at night is amazing.Interiors are also quite good, gives you a feeling of sitting in an old warehouse with dim lighting.",Rated 4.0,30,120,??
Pragya Gupta,"Rated Me and my friends often visit this place and actially never get bored of going back again. As the name suggests, the interiors of tha place are done accordingly. Plus the dim red light adds to the ambience. The music at the place is always nice and if u have a cricket match going on, you will truly enjoy it to the fullest on their large screen. Coming to the food, they have a big menu as per calender days. The food quality and taste is pretty nice and stisfying. The names of the deserts are a but wierd, example-"" bhains ki aankh"" which will actually be a vanilla ice cream with brownie. So its worth trying any ine of them. Then to the drinks, cocktails are nice and tgey sometimes have a limited beer brand and not everything on the menu is available. The place is badly crowded on weekends so better make a reservation prior going.",Rated 4.0,62,36,??
Pulkit Tuteja,Rated Good food. Good service. Great ambience and the very interesting thing about the cafe is the balcony of the cafe. It will be the good hangout place with the friends in the night so that they can enjoy the view in balcony. Laal maas is the good mutton ive eaten here and the fruit base sheesha...,Rated 4.5,10,33,??
Aakanksha Vohra,"Rated Since the day I have became a mommy, we were searching for a good place where kids are allowed and suddenly a friend told about warehouse cafe... when we reached here my first thought was that its a very small place but as soon as we entered we realised its a huge place with all kinds of seatings... Food is good and is served on time... Staff's courtesy depends upon the rush at times (which is justified too)... All in all a very good place for chilling, conversation and eating too...",Rated 4.5,43,95,??
Ajay Singh,"Rated This place is huge and tastefully done. They have a great collection of beers. The food menu is expansive and it never disappoints you. Have been to this place 3-4 times , and have never ever been let down, either by service, drinks or food. A must visit in CP",Rated 4.5,0,0,Expert in Connaught Place
Jatinder Singh,"Rated CP always having an options for great bars & lounges, as such is the warehouse cafe .Nice place to chill out. The things that we tried : Parmesan vodka pasta, Alfredo pasta, Veg tex mex burger and Murg Tikka. All of which were satisfying in terms of taste and quantity. The presentation of food is simple yet great. Great ambience, great food, and great drinks! And to top it all, the Happy Hours, which last till 8 pm! Ambience:4.5/5 Food:5/5 Drinks:5/5 Quality:4.5/5 Staff:4/5",Rated 4.5,4,55,??
Varun Bhalla,"Rated Great place to have a fun filled evening.. Chilled beer , good drinks , nice food... Very lively with music.. Bit expensive but everything comes at a cost.",Rated 5.0,11,181,??
KARAN CHUGH,Rated One of the finest places to sit and relax with your friends with a top notch ambience and great food.Its really very spacious and the service is too good.,Rated 4.5,10,50,??
Hunsil Nisa,Rated Nice place to visit. Nice terrace also. love the food you serve. Service is impressive. Nice music and lights inside ... Classy place I hope to see you soon.,Rated 4.0,25,19,??
Atul Paul,Rated Had heard a lot of good reviews about this place so I decided to go there with my gf and I was amazed at how true it was. The place has a very nice overall feel to it. A light faint smell of hooka greets you when you enter the place. I am a fan of places that are a bit dark and this place fits the bill. The ambience is good and the couches are comfortable. We ordered a couple of mojitos and another mocktail which was suggested by the waiter. Food came on time and taste was good. Overall I would say its a place worth visiting again. Prices a little on the higher side but pretty decent for cannaught place standrds.,Rated 4.0,15,133,??
Jaskirat Singh Khera,Rated From seeing this place from outside I thought that this would be a small place but from inside its so huge. Its outside sitting is also good . The huge bar counter looks so good n the ambience id great,Rated 4.0,0,0,Expert in Connaught Place
Shraisy Lamba,"Rated Nice hostile staff. Tried mango mint smoothie and liked it.. Chilly chicken was spicy, yet a great treat.. Overall nice experience!",Rated 4.0,5,30,??
Shilpi Jain,"Rated have been to this joint twice, and enjoyed the experience. Food is good, but the cocktails are a big lowdown. All juice and no 'juices'. Well the good part is they have hookahs. Sundays are crowded and you need to make reservation or wait for sometime for a table. The music was nice.The service swift. in case you are a soccer or cricket fan, they hv a projector and that will keep your party rolling over beers. my rating: Food: 4.0 Service: 4.0 Bar and drinks: 3.0 Music: 4.5",Rated 4.0,35,68,??
Sajid Vincent Ledger Khan,"Rated Me & the wife stepped in and the combined 1st reaction by us was ""damn its a huge place"". Sitting area is spread over 2 levels, both indoors & outdoors. Really loved the long bar counter. All in all loved the ambiance. We sat on the top level outdoors. The service was a bit slow but the servers were very polite & informative. The food was simply exquisite. Together with my bourbon and the wife's cocktails, we ordered the following; Bhuna lamb in lettuce leaves Tandoori mutton tikka Tenderloin steak Grilled fish lemon caper Brownie with hot chocolate sauce My rating; Food - 4.5/5 Ambiance - 4.5/5 Service - 3/5",Rated 4.0,0,0,Expert in Connaught Place
Aditi Shahi,"Rated Warehouse cafe is one of my favourite places in CP. It's quite popular and a great place to hang out with friends. Great ambience, great food, and great drinks! And to top it all, the Happy Hours, which last till 8 pm! The interiors are pretty cool. And the place has a few types of seating to offer, including one on the rooftop. We ordered chilli chicken and pesto pasta, and Daiquiri and pina colada for drinks. I quite liked their daiquiri and chilli chicken. While the pina colada was a downer for me, and I wouldn't recommend trying it. The pesto pasta with garlic bread was absolutely delicious!",Rated 4.0,0,0,Expert in Connaught Place
Sonal Mittal,"Rated An awesome place to be with friends in the heart of d city..an evening spent here would be memorable..with good food and music, this place is worth many visits.",Rated 4.5,35,32,??
Orin,"Rated I'm giving this establishment a 2.0 rating only because of that cool gadget they have on the tables you can press a button on to ask for service. Warehouse Caf is your regular Shisha lounge for ""cool"" kids to take pictures at to fill up their Facebook albums. Food : Ordered Beef Fry and Basil Tomato Pesto Panini. The only semblance of flavour in the beef fry was the chilli, which was too spicy, and that wasn't mentioned in the menu. The basil in the Panini existed only in the menu, the filling being plain shredded chicken rolled in Mayo. Drinks : One pitcher of beer served at a temperature right when the taste starts to die, with half the glass foamed up. Ambience is that of a shady rundown bar. Lights are way too dim to find your way around. Horrible house music played at a volume only a step down from supersonic. Conclusion : Wannabe. I don't know what caused me to stay and place an order. It may have been the tiredness from walking all around CP.",Rated 2.0,2,13,??
Anik Bhushan,Rated One of the most happening place in Delhi..awesome ambience and food..high on energy and courteous staff!! Love this place!! If you want to have conversation with your friends then its not the right place.,Rated 4.0,5,81,??
