Username,Review,Rating,Total_reviews,Followers,Expert_level
Somya Pandey,"Rated I visited this place for a dinner. There was a concert going on. The sound was too high. Thus I choose the rooftop seating. The seating was quite good and there was nothing special about it. I ordered a veg shawarma roll and a Bell peper Margarita ,Batch Type Vanilla Vodka which were quite good and filling though a little bit dry. Overall it was an very good experience!",Rated 4.5,15,17,??
Rajat Choudhary,Rated I simply love this place.i have never been disappointed Went for second time.Ordered Mustard Fish chilli with Beer and combo really worked well for me.Looking to visit again and try their complete seafood range for sure. I have a suggestion they should bring more variety in Draught beer.,Rated 4.0,18,4,??
Nitanshi Agarwal,"Rated A typical cafe in connaught place, it wont offer you anything different as such. The food is decent, slightly over priced and very standard. I had a margherita pizza and my friend ordered a chicken sandwich. Both were nicely prepared, then again, not very difficult dishes to prepare. I would only go to this place if I couldnt find a better restaurant in cp!",Rated 3.0,22,19,??
Smita Kainth,Rated I really like this place. Huge sitting area. The menu is quite interesting. And I really like the food and cocktails served here. It was quite busy when we went and even then our didn't take too long to come.,Rated 4.0,67,104,??
Latika Ogra,"Rated A name which all of us have heard in few major cities....! Plus:- location(which goes widout saying, Lovrd thr view of our FLAG), ambience (lovd d rooftop sofa area) and arrangements, staff, nice innovative menu card.. Ohh..nthg Plus in food kya.. Minus:- food quality; veg nad nonveg both,few options for Beer, last eveng had live solo performance too(which made lot of enthu in start) but the artist looked like,not able to connect wid public so that went little draggy at times ,no cards accepted(nt sure ,was that the 14Feb effect or what ) which made the payment process little time consuming (thnk God,one of us had dat much cash to payout bill & dat ws jst d luck time). our order was cheese french fries nd Chikn 65 & both were widout any sauce,very dry,no flavour and chikn was very hard. Chicken hot n sour soup{yeh achha tha.. :-)}. Hoping better quality nd taste in next visit.",Rated 3.0,25,24,??
Gaurav,Rated It was my birthday when i reached this place. And it was my 1st visit in warehouse cafe. Coming to the food we order cheese spinach corn role it was worth it. And pasta was very spicy wid bread toasted. Drinks was good I personally liked it But when it comes to service they took a lot of time. Which i don't like. Plus the servicemen or order taking people don't know how to tlk to there customer Food 4/5 Music 4/5 Service 3/5 Ambiance 3/5. Presentations 3/5,Rated 3.5,61,49,??
Sumit Chakraborty,"Rated My second visit here and it keeps getting better. The service is immaculate and the staff are really on top of things (Mukim deserves special mention for the excellent Hookah). Good food and great ambience. The rooftop is recommended for a great evening, especially for the fantastic view of Connaught Place. Keep up the good work chaps.",Rated 4.5,7,8,??
Ved Prakash Gupta,"Rated Really good food, specially pizzas and starters. Fast service. Great ambiance. Rooftop dining. The band was horrible but he left early that day.",Rated 4.5,5,122,??
Prithvi Godi,Rated Okay.. So i reserved.. And I got a confirmation.. But someone who answered the call had the audacity to tell me that the confirmation didn't matter and that they only serve customers on first come basis.. Thank you so much for wasting my time..@warehouse cafe,Rated 1.0,2,39,??
Prianca Khatri,"Rated Certainly ambiance was good but the food was tasteless we ordered pizza which cheesey topping was like rubber,pasta was uncooked, chocolate shake was like chocolate in water total waste of money..",Rated 1.5,2,9,??
Aastha Parmar,Rated The most talked about cafe in cannaught place. I visited here for the second time and we ordered for pasta and pizza. The white sauce pasta lacked spices and didn't tasted good. The warehouse special non veg pizza was no doubt really amazing in taste but it lacked chicken pieces. This experience of warehouse cafe was totally unsatisfactory. Only these 2 things costed us 1200 INR we could have gone for some buffet restro rather.,Rated 3.0,0,0,Expert in Connaught Place
Aditya Panwar,"Rated We went on a weekday, daytime. Ambience is nice, though they can work on their warehouse theme some more, service is a bit lazy-ed up too even during the daytime. May god help them on weekends'. They played good tracks. Food is worth every penny. Good food and a rooftop worth partying at is their USP.",Rated 3.5,3,27,??
Bharat Bansal,Rated Bad food bad service Dirty tables Stinking fresh lime soda Tasteless pizza which is know as warehouse signature Not a worth place to visit Bad experience,Rated 1.0,1,2,??
Urvi,"Rated Went there a couple of days back, absolutely loved their ambiance specially the terrace and roof top with a variety of seating options from high bar chairs to couches and garden chairs and tables. Had a chilled out relaxing time there! Ordered a paneer starter which was just about average, and a pizza. The food was pretty ordinary but they have an exhaustive menu and some other dishes could be nice. However I would suggest the place for its ambiance and the relaxed feel of the place. The staff was pretty responsive, courteous and helpful but couldn't help us with correcting of a dangling table, err. The do have some room for improvement at various counts. But I would surely visit again especially for the ambiance and to try other menu options! Surely head there on a pleasant sunny day for the roof top experience!",Rated 3.5,31,76,??
Sachin,Rated Really like the ambiance specially the open space. Though food was average so were the mocktails. Ordered warehouse pizza n staff didn't bother to ask if we like it or not plus was cold within like 5 mins and have to tell them to reheat. Once they start serving food outside its place to sit n relax in the evening with amazing view of canaught Circus.,Rated 3.0,6,1,??
Nitesh Bhardwaj,"Rated I am in love with this place's chicken shawarma. Super super delicious rolls with a great size, not too small not too big.The customer service is fast and helpful..Great place",Rated 4.0,7,55,??
Ravi Agarwal,"Rated Super location, good food, open air, good music, good service. Little loud in terms of music incase you are here for day time meeting or lunch but good place. Parking nearby.",Rated 5.0,8,51,??
Kapil Sharma,Rated Went second time and liked it again tried this time Conti food. Ambience is cool with nice music played and it's huge.even this time could not get sit on terries but inside too wasn't bad staff is cordial. Now food Vonton soup 4**** Chicken staganof4***** Stuff chicken in mushroom sauce 5***** In all it is must try place.,Rated 4.0,46,60,??
Vivek Wadhwa,Rated The food was pathetic. What i ate Starters :- Chicken dishes were UNDERCOOKED Veg. :- i don't eat any Drink :- mocktails took ages to be made Cocktails were pathetic Lets talk main course 4 dishes 2 veg (which I didn't taste) 2 non veg One was some crappy dish made with lamb which had vegetables in it than lamb and it looked more like a Manchurian dish than anything associated to lamb Second was a chicken dish in white gravy which was so bland that I ended up eating just NOTHING. I should've given a minus rating if there was a provision One advice for all just never plan a group party for this shit junk place. Waiters don't hear you out properly. At the end There are n number of places out there with much better food making skills.,Rated 1.0,1,0,??
Kshitij Verma,"Rated In an area surrounded by gazzilions of bars and lounges, warehouse cafe has to stand out..not only because of nice ambience and a great spread of food, but more so because of the amazing view of the entire inner circle from the roof top seating area.. Apart from the pitchers of beer, we ordered chicken Kali mirch tikka, chicken barbecue strips and a sheesha.. The sheesha, though incredibly expensive, was full of flavour and lasted a long while, the tikka was OK, though I'd expected a lot more juice in the chicken, but the fried bbq strips were simply amazing and easily the best part of the meal.. I'd definitely reccomend the place and am shortly gonna try their new outlet in Gurgaon(one I visited the day it opened and sadly had no liquor to offer).. Food 3.5 Service 4 Ambience 4.5",Rated 4.0,29,286,??
Jitesh Foodaholic,Rated Priyank Sukhija The Magician again waved his stick to fly us without Feathers The Sky Bar Launch today at Warehouse is just A Dream Terrace for ms which I was searching for ambience Full On Food is Yummm Must visit at this season specially in Valentine week,Rated 5.0,13,57,??
Malvika Thakur,"Rated In the heart of Connaught Palace facing the flamboyant Tiranga, definitely a place to be at the weekend. One of the best roof top restaurants in delhi offering elaborate menu for both bar and with cuisines, topped up with some wonderful live performances. The resturant is divided into various sections, however i found the rooftop to be the best one. Especially coz later it gets very packed downstairs. Had a great evening hope to have more",Rated 4.5,41,191,??
Shivangi Shukla,Rated I was in Delhi for like 6-7 momths and warehouse cafe was coincidentally the first place I happen to visit. And the occasion was my birthday... It was a weekend so it was full crowded. -awesome decore -perfect ambiance -rly good crowd -service is good too All in all its a rly gud places to hangout. Easy to lacate as well Loved it.... <3,Rated 4.0,2,20,??
Gaurav Jalan,Rated I love this place . The perfect combination of Taste and ambience . No matter what you order . It always turns up to be amazing food . They have almost all the cuisines . Good place to dine and wine at the heart of delhi ! Must go !,Rated 5.0,4,5,??
Shubham Mukherjee,"Rated Its a place I greatly enjoyed. The food is good, the drinks are good and so is the ambience and everything. The open rooftop has a good if not great view of CP. It's a place I definitely plan to visit again. Loved the chicken cheese doritos. The place has enough sitting capacity to accommodate last minute crashers even on a Christmas night.",Rated 3.5,16,22,??
Krit Singh Jamdagni,"Rated Good ambience awesome food imported drinks well staff Good music. Little costly but worth it.. Awesome place to visit with family, friends and love ones.",Rated 4.0,6,1,??
Isha Dara,Rated I have wanted to visit this place since so long and had very high expectations of it but it did not turn out to be THAT great. We sat outdoors on a sunny afternoon in February. They have a huge terrace and which is quite impressive. We ordered honey chilly chicken and warehouse special pizza and two kingfisher ultra and it costed us around 1700. Honey chilly chicken was average and we did not like it much. The portion was also small. Value for money? Don't think so. The pizza was really good. It was vegetarian with generous amount of cheese and toppings. I wish they had tissue boxes instead of tissue holders on the terrace since all the tissues would frequently fall off due to the wind and they had to dump all of them. Guess that's a lot of wastage.,Rated 3.5,8,3,??
R O Hi Jain,"Rated Tried penne with tomato vodka, it was nice. A little over priced but what can you expect if you are in CP. A nice place to visit with friends.",Rated 4.0,18,81,??
Sakshi Sharma,Rated What a place!! What a place!! Amazing ambience and food....superb quality Food was so tastyy that the amount I paid was totally justified Must visit,Rated 5.0,4,1,??
Scarlett O'Hara,Rated So we visited this place last Saturday. Good food. Good music and nice ambience. Service and was fast as well. Moreover it had like three floors and they were playing with different music every where. So u can choose according to your mood. We choose the terrace and it was amazing A must visit place in CP.,Rated 4.5,7,40,??
Priyanka Arora,"Rated Liked the ambience of the place. It is a good hangout place for friends. The menu had a lot to offer when it comes to food. My friends and I ordered the kasturi chicken kebabs, veg enchiladas, mushroom kurkure, veg spring rolls and chilli paneer. I liked the kebabs and mushrooms. The rest of the lot was average. We also ordered a few cocktails. The cocktails were satisfactory. Nothing innovative on the drinks menu. Some options were only available for a pitcher order which was a bit of a disappointment. Overall, this place was good for the food.",Rated 3.5,13,68,??
Megha Goel,"Rated I went to this place 2-3""times. They had a huge menu..nice ambience, very quick service. .it's a favourite place of mine. ...it's a very busy place on weekends. .. .so if u reserve ur table in advance then it will be more convenient",Rated 4.5,6,10,??
Nish Saxena,Rated A great cafe in the heart of the city. Its open till late night so enjoyed a lot with friends and they had some awesome music to which my foot cudnt stop thumping the floor nice interiors also...not too expensive but totally worth it,Rated 4.5,14,57,??
Ravneet Kaur,"Rated I visited the place along with my buddies on Saturday, 30 January. It was not for the first time i was visiting this place but this Saturday meet with friends was special so i thought instead of trying a new random place i should go to the tried and tested place , The warehouse cafe. I wish i shouldn't have taken that decision. We started the evening by ordering beer n a cheese Nachos. The beer seemed overpriced compared to any other place in Connaught Place at 4PM , as there were no happy hours. The nachos were all soggy.. Then we thought its okay lets order a hukka and a pizza. Hukka was just OKAY nothing special that too for 1000.. eeh another mistake... Now we didn't want to move our ass to some other place as the chit chat was giving us the necessary hit. Then ordered a pitcher of blue frog, thinking a cocktail would add stars to the evening.. but it turned out to be the same PATHETIC and a fraud as the alcohol content was very low and the drink was diluted. By now i was completely pissed. Complaining to the staff was a choice i had but could not opt for it as the staff was extremely impolite. Now was the turn for another turn off the bill... all this bullshit costed me 5000 bugs.. i was like what the f**k. How could they .. then i looked around and realized they are in the business of making fool and I was definitely just another customer to them. I would NEVER recommend this place to anyone and will never visit there again... I think the administration should step out and see the way other cafes in CP serve and the quality they serve. SAD, DISAPPOINTED, DEJECTED and ANNOYED i was by the end of that Saturday night. @richa Mohan @vaishnavi bansal",Rated 2.0,10,72,??
Sur B,"Rated Whc is a top listed restaurants in cp. It serves delicious food, be it Italian or something else. Really appreciate the chef for making dishes so nicely..i have bewn there countless times. Good music- good Ambience, what else you want after this. Keep it up",Rated 4.0,16,24,??
Garima Agarwal,"Rated warehouse cafe seems to be the go to place every time a group of my old colleagues & I want to get together & I must admit.... I'm never disappointed! Really yummy food & reasonable pricing. Definitely recommend if you're with a group as well,portions are great! Definitely looking forward to visiting here again in the future.",Rated 4.0,9,100,??
Abhishek Kumar,Rated Delhi winters hangout with your best buddies open area dinning and beautiful live music what else do you need for a perfect Sunday. This place has been here for quite sometime didn't had chance of visiting. Finally came in had great time singing around with friends and food. Loved this place will surely be coming again. I would rather say will join late to enjoy more live music ;),Rated 4.5,26,60,??
Rajiv Gupta,Rated ONE OF THE WORST PLACE FOR FOOD OR DRINKS OR EVEN HOSPITALITY. Where to start... It usually happens with a place which make me angry like anything else. Still I will write. 1 is the lowest rating that's why one. I heard a lot about this place from people and my Zomato feed. Everyone talked some good things about this place so I finally decided to go there yesterday with 2 of my friends. Firstly the lady who stands downstairs near lift told us that there is no waiting so we decides to board the lift. Reaching upstairs we were greeted with a waiting list and asked by a manager(yeah that's what he seems like) to stand near the drinks serving area.. We waited for ten minutes and realized there are people coming and taking seats. We then asked a manager named Mr. Suri I guess and he asked us to take seat in front side from there a waiter asked us to take seat somewhere else and we finally took a seat on which Mr manager behaved so rudely that how can we enter family area as if you broke a queue for free ration... (Sir you forgot to put a board saying family area.. You forgot to train your waiter that he knows which area is that.. You could have asked politely). By seeing such a careless and rude behavior we thought of leaving but still decided to have food thinking that there must be something extraordinary about food here otherwise people shouldn't have given such a good rating to such non professional and rude managers and waiters. We ordered a dahi kebab which was totally blend in taste... Most of the beers were not available... The one available was not chilled(hot beer that's why the name has warehouse Cafe). We then ordered a achari paneer on another manager recommendation which was made such a spicy that after one piece we had to keep it side(although I hate wasting food)... The bad story continued... We asked for wifi Password to which we were informed that it's not for customers... Then suddenly a guy came out from somewhere and asked us to install a app named rupli.. And he gave the wifi Password as well(ah!! Surprised) .. Finally when the bill came they didn't even had a working credit card machine (do I still live in year 2000 or they think that they are giving food at such cheap prices that people always carry few thousand bucks in cash?) So in all worst food.. With worst service... But some good ambience..... Definitely not going again and will help people getting aware about this place before going.. Name suits them well (warehouse cafe),Rated 1.0,137,2990,??
Diksha Garg,"Rated One of my preferences for parties. Awesome ambience, average food and nice music. The kebabs were a disappointment though but the pasta adds to your happiness.",Rated 3.5,20,33,??
Drishey Valecha,"Rated The DJ in the house is well equipped and the music captures your attention. Although there isn't much dancing space, one can't just sit around and not groove to the tunes of the DJ. Tidbits for nibbling are just fine to have with your drinks. Food is even better. They do serve drought beer. Nice place to have a good time as they offer both indoor and outdoor seating with sports screening facility.",Rated 4.0,19,5,??
Simran Bal,"Rated If the weather is nice and I'm in Central Delhi, I know exactly where I'm going to go for a decent meal and some great conversation. If you appreciate outdoor seating as much as I do, this place will win you over!",Rated 4.0,11,3,??
Rupish Saldi,Rated The place is nice during night hours. The only concern I had was that food was not that delicious (except dahi Ke kabab) but the music and ambience is really nice of this place.,Rated 3.0,17,74,??
Ankita Adhikari Verma,"Rated Situated at the heart of the capital, spread over two floors and a view of the connaught place and the Indian flag is awesome, the food tastes good, amazing sandwiches and Italian.. the evenings are beautiful.. and the gentry is usually good. A winter afternoon is must take experience here when u can eventually see the sun setting down. If you are a foodie then you must explore the cute calendar menu.. and experience great food",Rated 4.0,4,41,??
Rishit Gupta,Rated amazin! simply amazing place went there maybe a couple of hundred tymes now!hfaieffifeioutiauwestigreiyhhreghgidaftqureiutiasjetigfjrtiuirejtijg,Rated 5.0,1,2,??
Aanchal Makhija,"Rated Though i dint order any food there, but i really liked the terrace ambience. It is really good. I just had virgin mojito and i am going to visit that place next again only for food.",Rated 3.5,23,92,??
Star Swati,"Rated Diverse menu, at times, surprisingly, ""wow"" me :) Though saying the same every time, will be little exaggerating. Found the terrace interesting, even in chilling Delhi air. Music here boosts me up every time. Surely will give another shot soon to try cocktails. Let's see how well they can mesh up ;)",Rated 4.0,2,1,??
Riddhi,"Rated I had gone here with a group of friends,around 4-5 people. We sat in the covered area, and there were hardly any lights. I know cafes are supposed to be not all bright and stuff but this was way too dark, with no music. The service was below average. The person serving us and a few of the other waiters were standing very near to our table and that was highly uncomfortable. We ordered an achari paneer tikka and French fries, and soft drinks. The French fries were okay. The paneer tikka was bad. Me and one of my friends got a minor food poisoning after eating it. I mean, I'm paying so much just to fall ill? I don't think I'm going to this place ever again.",Rated 2.5,15,23,??
Avika Sukhija,Rated The newly renovated warehouse terrace is just wonderful . It's just the perfect combination of amazing decorum and mouth watering food . The music also has a perfect volume not too loud but loud enough . It's just amazing !,Rated 5.0,4,3,??
Shake'stir Rider,Rated Been there a long back. And luckily it was a special concert night. Usually I am not sure about the cocktails but I would say it was worth trying them. Staff is courteous. Food is okeyish. All in all a nice place to hangout with friends.,Rated 4.0,3,4,??
Anshul Roshan,Rated Beautiful is the word outside seating is totally out of the world when you look towards CP overall nice place to have few drinks over some business or romantic talk.,Rated 4.0,60,40,??
Mukesh Moody Bansal,Rated Amazing place with great ambience and food ! Live performance is a big plus that adds to the mood! We held a get together of our school friends enjoyed it to the fullest. Service is good and prompt! 5 Star !!,Rated 5.0,5,7,??
Abhijeet Singh,"Rated Gf and I was hanging out in cp and unsure of what to eat when we saw this place. Always down for a good pizza, the pictures looked pretty good. I got the spicy lamb pizza and she got the Grilled Fish Burger. Both the items were fresh and tasted so good. A bit pricey but the food is worth the price.",Rated 4.0,7,47,??
Harshit Surana,Rated The restaurant is ideally situated in the heart of delhi and attracts a very decent crowd base. The ambience and music played all round is very good. Food is good but if you wish to visit warehouse cafe only out of hunger you have many better places in delhi.,Rated 3.5,7,30,??
Naina Malhotra,Rated One of the good cafes in CP. Definitely worth visiting. They make good cocktails and food too which is a rare combination. Food - 4 Service - 3.5 Ambience - 4 Reservation is recommended.,Rated 4.0,67,175,??
Nandita Sharma,Rated Kudos to this cafe for keeping up to the theme Nice ambience ...a good place to have a lil party with friends with a really nice service And the plus points go to the Speed of the serivicebecause when you are hungry you just need to get your fpod ASAP and this is a place whre you get TASTY food in a short span of time. Even the main course is nice which is a rarity in most of the cafes..,Rated 3.5,31,38,??
