Username,Review,Rating,Total_reviews,Followers,Expert_level
Ankita Agarwal,Rated Nice music. Food was ok. Bot that great. 3.5 because i don't like dim light ambience. Good service. F 3.5 because did not like ambience and food.,Rated 3.5,14,47,??
Prashant Yadav,Rated Long wait time on weekends manager told us to wait for 20 minutes but it took around 45 minutes to get a seat. Mismanagement on the part for the seating arrangement food quality and ambience was good,Rated 3.5,2,4,??
Piyush Dhawan,"Rated I believe Warehose Cafe has the perhaps the best view of the inner circle but also perhaps one of the worst service in the inner circle as well. It is certainly not the same same service that was offered when it initially opened. I had gone with my friends and were meeting after ages and hence decided to go to Warehouse to catch up, it certainly became a catch-up game with ther service staff. It was like our duty to request and remind the staff that we had ordered something to eat and to drink. I have never come across a place which has 3 different staff people ( one to get only food menu, one to get drink menu and one to get Sheesha menu). They certianly need a basic course in managemement and also i don't really undertsand the possesiveness with Menu cards ( first for a group of 6 people we get only one menu card, i don't know if they want us to pass it on to everyone or if they actually haven't got more printed menu cards, and as soon as you order they quickly take it away as if we are gonna steal them and take it back to our houses) , anyways the food was at par ( certainly not the standard of a three point something restaurant). Someof my friends who had been to the place earlier cautioned me to notice the bill in detail as they had discrepancy in their bill, perhaps it was not a good day for warehouse with us ( we also had extra drinks put on our bill and it took more time for them to change the bill than getting the food). I sincerely hope this place gets its act together as certainly as it is not even 50% of what it used to be. I also believe that they should stop flaunting the music system, someone should tell them that playing loud songs on highest volume is not cool anymore, people genuinely want to talk and not want to shout at each other. What a waste of money!!",Rated 2.0,1,40,??
Deeksha Mittal,"Rated The place's ambience and dim lighting manages to do wonders in covering the quality of cold served food.My rating goes up for the place's quick service and ambience. Otherwise with the food quality, they deserve nothing more than 2 !",Rated 3.5,5,2,??
Ravi Pratap Singh,Rated A good place to go...sexy ambiance with good food quality and service...loved it...BT little expensive,Rated 4.0,6,23,??
LBB Delhi & Gurgaon,"Rated A massive seating area, plush leather sofas, a noir film reminiscent long bar, baroque chandeliers, and a terrace overlooking one of Delhis most iconic zip codes - Warehouse Caf looks like a warehouse, after an extreme home makeover. The only detailing testament to its name are perhaps the bare-bricked walls, high ceilings, open ducts and industrial-inspired lighting {bordering on ambient}. An interesting mix of rustic and regal, Warehouse offers the standard fare of cocktails, shots, a multi-cuisine menu, live match screenings, loud music, and major human traffic. The food menu has on it 365 options, one for every day of the year! Our 2 Cents | Warehouse comes alive during peak sports seasons, and should be at the top of your list for some major sport{ing} spirit and barely containable enthusiasm. For the minimal conversationalist, the decibel level of the music indoors will provide a safe haven of sorts. For the conversations-over-cocktails supporters, the expansive terrace should be your choice of seating {PS - it overlooks the newly installed Indian Flag, Central Park, and CPs crescent inner circle; all in all, an almost unbeatable view}. Winning Drinks | Definitely try the LIT, Mai Tai and the unusual Bell Pepper Margarita. If youre part of a bigger party, the pitchers are great value for money; we recommend the Watermelon Supernova, Psycho Jack, and the Faithful B****. Do Note |The food menu is designed like a calendar, where every item on the menu corresponds to a date. To give you a little incentive, if your order the dish listed on the 11th of April, on the 11th of April, you get a 50% discount on that particular dish! littleblackbookdelhi.com",Rated 4.0,15,102,??
Nishank Gupta,Rated I love non veg. starters of warehouse cafe ! And the view of our flag from the terrace is just amazing...,Rated 4.0,10,1,??
Viren Gupta,Rated The place is ok......its dark......service was ok......music was good but too damn loud.........menu was awesome,Rated 3.5,23,57,??
Avneet Kaur Reen,Rated Great food! Loud music! A place to bang on wid crazy frnds..,Rated 4.0,8,47,??
Varun Seth,Rated First visit to warehouse cafe and i loved it. Food is very good. Loud music makes talking to friends practically impossible.Loved the ambiance but hated the fact that its not a club.It has an amazing terrace with an amazing view. Simply loved the genre.There is no doubt about the fact that this is the place to be if you in the capitol city.2 thumbs up !!Cheers!!,Rated 4.0,10,9,??
Garvita Bansal,"Rated I totally loved the place. Starting from the entry to this place by a lift instead of door makes this place stand out from others. As soon as you deboard the lift u r welcomed by the bar side. Trance music and superb crowd is the main attraction. Then the menu in the form of calender is anoda new concept. For all those ppl who r fond of boozing n smoking hooka, this is d place to b at in cp. Beer, hooka, food. Loved it totally.",Rated 4.5,20,72,??
Abhishek Ashish,Rated Good place .. Has great and loud music.... Ambience is nice and dark and u can enjoy in ur own grp without being bothered if anyone is noticing you... Food is above avg.. Need not try something very new.. General foods are good... Bar is excellent... Hookah is available... Must try,Rated 3.5,7,22,??
Meghna Chaudhary,"Rated The ambience is quite soothing. Service is pretty good, must visit during happy hours.",Rated 4.0,15,164,??
Neha Khandelwal,Rated My All tyM faV plaCe ... Ambience ... Food sErvice ... Evrytyng z so amazng ????,Rated 5.0,2,22,??
Shreya Jain,Rated Watehouse cafe.. The place is totally opposite the publicity it did! I found that the waiters were least bothered to receive the guest and were unaware of actually constituents of dish. A total let down after a hype on large scale.,Rated 3.5,4,21,??
Apurva Jain,Rated Good ambience... But bad food n over priced...,Rated 2.0,2,26,??
Mohini Dabarwal,"Rated I have had been waiting to hit 25 to see this place since they turned me down every freaking time for drinks which though I hated, I appreciate too since that shows the ethics of the place. It is one of the best places to grab a drink in the town and the ambience has an upbeat feeling to it. Almost alway crowded is how you can describe it as well may be. It is dark and has a warehouse type feeling to it. We ordered the hukka, a corona bucket, nachos with chicken and chilly chicken. The nachos were great with plenty of chicken snd cheese. I initial ordered a hoegaarden pitcher but unfortunately as I mentioned in my earlier reviews, it isn't available at most of the places. The ushers were helpful and helped with the selection and the place has great DJ honestly. I saw people enjoying at the bar as well and I think the crowd didn't look rowdy at all there either. The ushers managed the crowd decently as well. Two thumbs up for the place. Cheers!",Rated 4.5,73,545,??
Arsh Sharma,"Rated Its a nice enough place. Went with a group of friends. Had fun. They are very strict about the drinking age. So if you are under 25 I might suggest that take a walk. You'll find nice places nearby who aren't so strict. The food is okay nothing super special for the price you are paying. But the ambience was very nice. That made the experience worthwhile. My recommendation: if you are looking for a hukkah place. You should definitely go here. I am being a little stringent about my rating but I can't rate a bar of I hadn't had drinks there, right?",Rated 3.5,79,296,??
Anurag Chaudhary,Rated A very nice place to be in. I went there with friends for a party. The food was good and service was also good. The place is a good hangout in heart of city.,Rated 4.0,14,35,??
Shivanshu Rungta,Rated The Restaurant is good. Nice place to hang out with colleagues and friends. The Service is good. Presentation of menu is some way attractive.!!,Rated 4.0,7,85,??
Arush Dev,Rated Good place. Nice loud music to enjoy. Food is Ok Ok.,Rated 4.0,8,136,??
Vaibhav Gupta,"Rated if there was a way to mark negative rating, I totally would for this place! since the time we entered to the time we left , the feeling was - disappointment.the staff was unpleasant and rude. there was no coordination amongst them. made us shift the table ten times because apparently it takes a light year to clean one. a couple of them were, I think, drunk... no kidding!reached the place at 10, were finally seated by 11:15, kudos to us for not leaving... and at 11:30 , one server decides to come to our table and say, and I quote, "" sir jaldi peelo, warna pullse (police) a jaigi"".never been so disappointed.",Rated 1.0,5,2,??
Vivek Kulshrestha,"Rated Warehouse cafe has secured the rightmost place on CP. The best thing about the place is its Outdoor sitting. Very beautifully arranged dcor.It should be the biggest Pub by capacity(let me know the place bigger than this).U get to see a different Menu here.there r various types of sitting options to choose from whichevr suits the need and occasion. Downsides are overcrowded,noisy and low quality food. Still,the best terrace on CP.",Rated 3.0,18,25,??
Kiran Sarna,Rated Great place great decor and great menu ! The size of the place is overwhelming. The place is always full of people and sometimes you might have to wait for a table but in the end it is quite worth it. The quality of food is very good and the service guys are very helpful. Another hit in CP,Rated 4.5,5,3,??
Kunal Sharma,"Rated Not much satisfied with it. The food is not so good , the tenor is good but the radiance is very low. I would rather eat stuff from the nearby khan chacha outlet . :P",Rated 3.0,5,43,??
Atul Bansal,Rated Very good,Rated 4.5,2,2,??
Prateeq Kumar,"Rated Ah well. we have all been to warehouse cafe. and we all love it. It has an amazing terrace with an amazing view of the imperial India. Food is good too. But most of the times, they make me wait for food for longer than what my patience can tolerate. I am not sure if they do it particularly with me or everyone else. i have only visited the place on weekends when its full, so m not sure if i can blame them. If you have not been to the place, please go.I love ordering food saying ""I want 18th of of August"". One thing: sometimes music is so loud, we cant talk and that is not nice. Its not a club, we do want to have a conversation with our friends.",Rated 3.5,24,151,??
Anubhav Sharma,"Rated Ok, well this one had it coming, after a delay of almost more than a year I finally visited this place situated in some hidden spot of inner circle. Never realised I used to walk past the venue almost everyday, anyways getting back to the point. ""Good space and nice environment"" but the service was horrible. Food was ""Mmmk"" but the worst of all was the music or should I cal is the noise being played in the background. Well Warehouse cafe, you gotta step up your music game man.!If you have a fetish for space, well you may wanna visit this place, good place to hang out in the heart of the city, I will say that try it once atleast and yes not to forget they had some col offers on drinks if you order large amount. In a nutshell:- A little pretentious, hyped and overrated place if you will, but hey i guess that's what we Delhites are all about !",Rated 3.5,27,230,??
Ronit Dhawan,Rated Been their twice..and got disappointed.... They never have tables!!! ..you are always asked to wait....,Rated 1.5,4,13,??
Sheeba,"Rated Visited with my friends at Warehouse in CP for the first time.It was Saturday night and the place was full had to wait for 30 min to get the table.The place was dark with dim lightning, nc music which was loud but tolerable. Ordered veg and non-veg platter,pizzas,chilly chicken nd mutton seekh. Everything was nice but service was slow they need to improve on that.",Rated 3.5,28,76,??
Preeta Bhanot Dutta,Rated First time and initially we had a hard time juggling from one table to another..to find a good corner to sit but good things do follow so things unfolded gradually.. crowd is good.. food is average.. music is awesome..ambience is classy and very contemporary... njoyed a lot with a group of old pals..,Rated 4.0,133,470,??
Deba,"Rated When the entire CP area is deserted, few food stops are open. Ware house cafe being one of them, we stepped in happily. Amazed we were to find great music playing and a lively crowd. More amazed we were when our hesitantly ordered Pizza turned out to be better than so called pizza joints and chains. I loved the quesadillas and nachos. Almost reminded me of Guadaljara in Mexico. Rates are just ok given this is like an elitist place. Service is good and lighting is gothic. Someone brighten up the red lights please. Oh and not to forget the quirky posters and picture strewn all arounf the decor. The bar looks nicely decorated. Will be visiting this place again for sure!",Rated 4.0,87,250,??
Ashaya Jain,"Rated Its one of my favourite places in delhi..the food is really amazing, the ambiance is good...the staff is pretty courteous... And the sheeshas are amazing(expensive, though).. And deapite the fact that the place is usually crowded, we usually find a table in 10-12 min... Ambiance: 4/5 F&B: 4/5 Service: 4/5 Overall: 4.5/6",Rated 4.5,12,66,??
Siddhant Taneja,"Rated My all tym favorite place !! Awsum food , hukka , drinks etc...",Rated 5.0,51,121,??
Akshay Gupta,"Rated i like warehouse cafe for a informal meet with friends, the sheesha here is pretty good. i like the ambiance it is always full of people and the music is nice, however the food is not very good, the nachos were a bit soggy and not cheesy enough, the pizza quality was not that great. warehouse cafe is a nice place to go at around 5 with friends i would not suggest u guys to go specially for lunch or dinner.",Rated 3.0,113,689,??
Himanshu Dhasmana,Rated Awesome experience with nominal rates. Loved the ambiance and taste is good.,Rated 4.0,1,38,??
SarGun Bedi,Rated Disappointing ambience and service. Food quality was poor. All in all a big no no..save ur stomach ppl,Rated 1.0,32,79,??
Anand Singh,"Rated Warehouse Cafe ""A real good place to hang out wit' frnz..Bonny ambience, courteous staff, n absolutely mind blowin' food..What more can one as for!!"" A MUST VISIT..! :)",Rated 4.0,1,55,??
Visheshta Sharad,Rated Best tenderloin steak ever. (y),Rated 4.0,1,42,??
Sumit Chatterjee,Rated Nice Terrace!!! Nice View of CP.,Rated 3.5,30,98,??
Anujsharma.sharma660,"Rated Good ambience,",Rated 5.0,2,0,??
Yash Ujjwal,"Rated As soon as you enter this place, the first thing that strikes you is the number of Hookahs on table. Smoke's all over the place, so a word of caution to all the non smokers who just cant tolerate it much like a friend of mine, please do not come here.But if you are one, please do come here. FOOD-We ordered the Penne Al-Verdure, not knowing much about what the dish actually is. It was good, in fact really good and cheesy. Service was okay,not mind blowing or something to write about.",Rated 3.0,18,24,??
Anirudh Sharma,Rated Nice place.... Nice food...bit crowded but nice place to hang out with friends to have relaxed time,Rated 4.0,11,29,??
Puja,"Rated Soo went dere on a weekday aftrenoon..still it managed to have crowd.As u enter d ambience is gud bt not different as like other cafes in city, the service is not gud at all i went wd my 2 frnds n aftea half hr of sitting he gave us water.We ordered a niravan hookah,crispy chilli potato,pepper chessr roll n mix lime soda. Hookah was not at all in place we have to call d hookah guy ( as they told us there is a different waiters for hookah) in every half hour den after 1.5 hrs we didnt had it bcs we were so pissed off with it , food was very gud in taste specially d rolls,chilli potato were a lil too CRISPY n somebody plsss tell them how to make a gudd lime soda . Then d service part soo disappointed to go there as dey served us water when we asked for . Oversall not at all visiting there again, not worth the money (Expensive) ...guys u better improve ur service bcs there r so many newbies in city",Rated 2.5,3,3,??
Apoorv Gupta,"Rated Had heard a lot about this place and finally went there but not that much satisfactory as I was expecting. An elevator takes you to the place from the ground floor and there you go.. Ambience was nice but as expected nothing out of the box. Menu was like a calender as you can see in the menu section above but that doesn't mean you will get discount on the dishes mentioned on a particular day if you arrive same day atleast not in my case. Food was good but a bit on a costlier side taking the quantity in account they serve. Overall, an average place to visit n would be better if they would have lower down the music a bit, it was too loud for a lounge.",Rated 3.0,12,13,??
Archit Singh,Rated i order lemon coriander chicken it was soooo gooodddd The service was also very nice and quick and each attendant was very friendly and attentive.,Rated 4.0,6,34,??
Gaurav Agarwal,Rated A nice place to go and hang out with friends....But it is bit expensive. The interiors is good. Well furnished. Its not a place i would suggest on top of my list but still can not be ruled out.,Rated 4.0,8,1,??
Sandeep Gupta,Rated quite expensive in compare to other lounges nearby to cp....food is not dat upto d mark as expected and as charged....bt anyhow can b visited once nly for d sake of gud crowd nd gud music!!!,Rated 2.0,35,50,??
Vipin Chaudhary,"Rated Went there for the first time the food was good, drinks were awesome overall it was above average, the vibe there was cool !!",Rated 3.5,1,10,??
  ,Rated >> Review: I went here with my friends few months back. Menu is like calender featuring some of the best appetizers. Comprehensive review will be updated here soon,Rated 3.5,549,3211,??
Sur,"Rated Fell in love with the place when visited it firat time...last yr... when it was a newly opened one.... bit dark and hard to spot the staff at times.... but its a large cafe....hard to believe in a crowded place like inner circle.... very nice ambience, interiors, quite cosy seating arrangements and affordable.... always occupied these days... still like it ... :)",Rated 4.0,31,48,??
D.S,"Rated Went there on weekends with friends in dinner , we tried as a walk and waited for 20 min then manager accommodated us near there projecter wall , it was almost full in both the floor , terrace was too... Place has darkness , with very dim lightning , music was so loud but tolerable.. We ordered chicken tikka pizza which was very crisp and fresh , nice fusion of ingredients followed by chicken drumstick which was quite cold and soggy from inside just ok ok dish.. Drinks were good , we just tried there beer pitcher . Service was again just ok nothing extraordinary to mention . But we can say that happening place in heart of city....",Rated 3.0,0,0,Expert in Connaught Place
Ankur Mehta,"Rated Good place and good food. Today something strange happened and they had to close the kitchen suddenly. So weird there is no communication to any customers here and when we are giving the order, waiters are saying rudely no. Even the manger has same attitude.",Rated 2.0,1,18,??
Impeccable_Puni,"Rated What an amazing place....i would love to visit here again.... When my friend invited me here for the lunch...i heard the name ""Warehouse Cafe"" it seemed little wired to me. But to my amaze the interiors were amazing and food was also superb. The service provided by staff was also amazing. I would suggest you to visit this amazing place and i rate it 5/5.",Rated 5.0,5,61,??
Isha Dua,Rated The only nice thing about the place is their terrace seating. Service is pathetic-I was made to wait for a barstool to sit at a table for two. I ordered chinese starters and were absolutely horrendous. Buying drinks there only makes sense in happy hours. The mbience is too dark and the music too loud.,Rated 2.0,31,86,??
Tania,"Rated Good food, good music, excellent ambience, Dj's nice enough to take requests!",Rated 4.5,3,5,??
Ginny,"Rated Went there for a dinner with my family. The music is certainly too loud for a family outing, but surely great to be there with your friends... Went there on a Tuesday so the place was not even half filled.. Did not have to wait for a place to sit.. The seats are comfortable.. To eat we ordered a grilled fish burger, lamb donor kabab, chicken tikka masala, sabz khada masala, nasi goreng and roti.. The fish burger was certainly one of the best fish burger I have had. The flavors were great and fish was cooked to perfection.. The donor kabab were just OK.. The nasi goreng was below average.. Have eaten much better nasi goreng in at least five restraunts in Delhi.. The chicken and vegetables were just average like any basic north Indian restaurant.. Would like trying some other place next time!!",Rated 3.0,0,0,Expert in Connaught Place
Vaibhav Singla,Rated It is one of the most talked about things in the town. Its a nice place nice ambience food was like freshly delicious we just loved it too much. Staff is not ok. They do not serve even,Rated 3.0,11,37,??
Kanika Sharma,Rated Excellent Place to hangout with Friends. Nice ambience and music was BANG ON!,Rated 5.0,1,0,??
Vikrant Arora,"Rated Was meeting a friend and his wife after ages. They preferred a place in C.P and this place came to my mind as I had heard good things about this place although had never been to this place. It's recommended on zomato to book a table so I called up this place in the afternoon and a lady named Sangeeta refused to take my request for booking a table for 4. She said we don't take bookings for 4 on weekends, we only take bookings for large groups so you can walk in and look for a place. I found this a bit absurd but then this is Delhi and you just can't do anything about it. It was Saturday and we reached at around 9pm. The place was almost full but the manager gave us a table for 4. It's spread across two floors and then they also have a terrace. It was hot and humid so we preferred to stay in but we checked out the terrace and the view from the terrace was amazing. Al fresco can definitely be considered in winters or when the weather is pleasant. The server who was at our table was extremely arrogant and rude. I don't know that was wrong with him and I just didn't care to ask his name. I didn't even feel like giving my orders to him and time and again tried to catch hold of another server to place my order. This guy made my otherwise pleasant experience unpleasant. They have enormous options for hookah. We went with our fav one i.e Pan flavor and it was good. In mocktails we tried Adams apple and it was OK. Mojito was fine too. The shot glass in Jaggerbomb was upside down.. Don't think that's the right way to serve the drink but that can be ignored. In food, we ordered Half n Half pizza wherein you have a choice of choosing any two pizza from their menu and as the name suggests, the pizza served to you is a combination of both of these. Chicken tikka was good too. Mozzarella sticks were just fine. Hara Bhara Kabab was also fine. The music was pretty loud and we were finding it difficult to talk but basis the concept , it should have been only comfortably loud. We should have been more careful in choosing the right place when we were catching up after a long time. Overall it was fine. there are much better places in Delhi to explore before I consider going back here.",Rated 2.5,44,197,??
Akanksha Dutta,"Rated Best place to hangout wid friends....loud music, good food nd don't forget to try the Martini.",Rated 3.0,6,8,??
Madhvi Mehandru,"Rated I curse yesterday because God knows why i decided to go to warehouse cafe. Me and my friends pre booked a table through bite quest and when reached we were told you will have to wait... they said we didn't confirm the booking when I actually got the message that it was booked... Still we decided to wait and were hoping the food would make up for it... After waiting for half an hour in the gloomy dark place where you practically have to use your cell phone's light to actually read the menu (yes it's that dark) we finally got a table. We asked them for water and i guess the waiter practically forgot about it...we had to remind him after an hour that dude we asked for water an hour back.We ordered pizza Indiana ,pad thai noodles and two drinks and boy was the food bad. The pizza tasted stale and bland, the noodles were badly done like I have tried pad thai noodles in other places and they taste so much better else where. The drink as recommended by the waiter would be a good punch actually tasted like spicy water and nothing else. It didn't end there they didn't give us the discount that they were supposed to provide as we had a reservation through bite quest. The manger kept on arguing with us and then card was not accepted and we had to pay in cash. The food was highly overpriced according to the taste. The service was poor,music was loud adding to our disappointment about the place. All in all a total DISASTER... would never go back there.",Rated 1.0,2,48,??
