Username,Review,Rating,Total_reviews,Followers,Expert_level
Christina Peter,"Rated Niche graces CP with it's presence and with that ends the search of an actual Fine Dine in the vicinity. CP has over the past year completely been transformed and is now a hub of eateries. No matter where you look, either there is an existing restaurant or an ""Opening Soon"" signboard stares you into the face. Niche has entered the scene and would surely change the way CP looks at Fine Dining. Sprawled across two levels, Niche is as chic as it gets. The long bar alongside a live dessert counter (Yes, a LIVE Dessert counter!) is sure to catch your attention. Done in hues of Browns and Whites, this place exudes class. The seating is a comfortable mix of sofas and lounge chairs with a huge stage for live performances. What caught my fancy was the ceiling.. Niche has a see through glass for a ceiling and I'm already imagining how beautiful a rainy afternoon or a starry night would be here. Imagine, experiencing live music with delectable food and equally delicious alcohol and being able to enjoy the weather outside while completely avoiding the heat or cold. The outside seating is perfect for this weather, to grab a drink or to have some alone time with your loved one. Unlike most places these days, Niche doesn't have an elaborate menu which only means that you can be assured that whatever you order would not fail to impress you as it has undergone months and months of food trials! Drinks: Dillinger- This Welcome Drink is an absolute Party Starter. The vodka would soothe your throat and the ice would give the much needed punch.. Quite a Welcome I say! Daisy- Chamomile Tequila and Grapefruit bitters served in a bottle that resembles a luxury perfume is an idea that deserves a Huge Round of Applause and a Standing Ovation. Its so pretty...I wanted to bring it home. Shrub Step- Vodka, Balsamic Shrub, Mint and Basil. This makes for a delicious drink. Sorbet Bellini- Pineapple and Thyme Sorbet topped with Domm Pierre Perignon came highly recommended from the charming Mr. Mathew and no matter how much I thank him, its just not enough. The freshness of the pineapple against the bite of Thyme fixed with the fizz off Domm is a match made in Heaven! Food: French Onion Soup Rings- Crispy, light batter on juicy onions served on a bed of Onion soup is the perfect way to start a meal and that definitely sets the bar high.. Very HIGH. Vietnamese Prawns- Am a huge seafood lover, Prawns being ny absolute favorite. These were perfectly cooked juicy prawns set on a bed of tangy mango salsa.. Very refreshing. Chicken Arancini- Chicken Leg piece coated in a spicy sweet gravy, crispy skin and succulent insides would leave you craving for more. Hari Saag- Niche's take on the classic Saag and Make Ki roti. The saag is served with cottage cheese balls that are fried to perfection. The saag in itself is very flavorful and modern yet not interfering with the authentic flavors. A toasted bread replaces make Ki roti along with white butter. Its an absolute MUST HAVE! 62 degree Chicken Breast- Tender Chicken breast flavored with mace and cardamom butter. Its smooth as silk and the chicken is melt in the mouth. Dessert: Panacotta topped with Ice Cream and Fresh fruits. The subtle taste of panacotta against the tanginess of fresh fruits is the Perfect Climax to an Equally Perfect Meal. Head over to Niche for an experience that'll leave you rejuvenated. The staff is polite and happy to accommodate all your requests, participating in your nonsensical conversation, my fav staff member being Armaan.. Well done team Niche.. Counting days until you officially launch!",Rated 4.5,0,0,Expert in Connaught Place
Manav Sharma,"Rated My friends and I were visiting Connaught place (outer circle area) from Rajouri Garden last night and looking for a bar & Lounge to go to and we came across Niche - Lounge & Bistro and decided to check it out. The exterior of the building gave it a very excessive feel with one big wooden door that opened and closed. The interior was dimly lit and people were everywhere. The cocktails were very exquisite and unusual mixes and you could tell that the company put a lot of time into coming up with which ingredients to mix. I tried two different drinks that I can't remember the names of off the top of my head, but an ingredient in one of my drinks was a liquor that was exclusively made in California. I liked both of the drinks I tried, but I felt that the glasses were normal for the price of the drink. Overall, my friends and I had a good time at Niche - Lounge & Bistro. I would recommend it if you're in the Outer circle area of Connaught Place and looking for a Lounge & Bar then you'll definately go there .",Rated 4.5,14,461,??
Naman,"Rated I stumbled upon this place walking around the neighborhood looking for a place to have a drink and realized that this place is definitely my speed. This place is huge. The bar is huge and there is a remarkable amount of sitting space in the front and the back. We grabbed a seat at the bar which is typically where I find myself at places like this just because it is more engaging on different levels.The bartenders were more like ""mixologist"". I notice that this is really a growing trend around the city. The well polished experienced drink connoisseur that can do almost any trick with a shaker, a glass and a stirrer. They had a great wine list amongst many other types of mixed drinks. The vibe is relaxed and mature and I really couldn't have asked for anything more at that point. I would definitely come back here for a drink!",Rated 4.0,10,51,??
Nakul Bajaj,"Rated Amazing experience loved the good, great cocktails. Shrub step is a great cocktail everyone needs to go and check it. Also in food one needs to try the lamb shank. And do not miss out on the Shrestha! Would definitely Come back for more thanks a lot!",Rated 5.0,1,0,??
Shikha,"Rated Niche: Its quite nice sophisticated upmarket places in the outer circle cp at the second floor just above the chew pan Asian cafe, though it was their first day today. The place would be among top most places to dine -in cp quite soon . The terrace is yet to get operational, the usher greets you well n takes you to the table. The prices are bit on a higher side may be coz its a beautiful great lounge. They have a dedicated place out there for performances, bands, live music. I m sure niche would be among the top places in the cp. Wishing you all the best for your new endeavor. Good luck shikhz!",Rated 4.5,0,0,Expert in Connaught Place
